productId,Savings$,Sale_price$,Orig_price$,Item,description,productCategory,customerRating,numReviews,brand,initialQuantity,quantity,standardUpc,imageUrl
2Y4LYA8V30AG,150.0,249.95,399.95,Gemini GSYS-2000 Party Speaker System,"Home party system with dual 8 in. woofers and 2 in. by 3 in. drivers; Built-in multicolor LED woofers; Built-in media player features Bluetooth(R), FM radio, USB, and SD(TM) playback;",Portable Speakers,3.0,2.0,Gemini,170,170,00747705007124,https://i5.walmartimages.com/asr/68bb5a59-8fc2-485a-98fc-5daa673c2dd0.edf30c763965ab7f328ee7263288ad77.jpeg?odnHeight=200&odnWidth=200&odnBg=ffffff
2DQHMR8H4GI6,20.0,139.99,159.99,Seagate One Touch SSD 1TB,1TB SSD 2.5 ONE TOUCH USB 3.0 BLACK,Hard Drives,5.0,19.0,Seagate,112,112,00763649138588,https://i5.walmartimages.com/asr/8f2621aa-0f6a-4f92-9449-6bd955faf099_1.1ac3b5808f88eb44c833ffa647252859.jpeg?odnHeight=200&odnWidth=200&odnBg=ffffff
5YX4YCB55Z7O,110.29,35.71,146.0,SanDisk Ultra USB Type-C 128GB Flash Drive (SDCZ450-128G-G46),Merchandise,Flash Drives,3.0,1.0,SanDisk,117,117,00619659140359,https://i5.walmartimages.com/asr/773a14fe-33d0-4cef-b169-1bd5bdf1f7db.68da2ebc0f3c79781b19edc2c31fd04d.jpeg?odnHeight=200&odnWidth=200&odnBg=ffffff
2D7R77L75ATQ,30.99,229.0,259.99,"Acer Chromebox, Intel Celeron 3867U Processor, 4GB DDR4, 32GB SSD, Chrome, CXI3-4GKM4","Acer Chromebox, Intel Celeron 3867U Processor, 4GB DDR4, 32GB SSD, Chrome, CXI3-4GKM4",Desktop Computers,4.8,25.0,Acer,112,112,00193199552518,https://i5.walmartimages.com/asr/393e360c-763d-465a-99d8-60facb7570f6.245fb6eeff848f4571bdf9c3ecfed6bc.png?odnHeight=200&odnWidth=200&odnBg=ffffff
4LOENSUHM91G,42.32,87.67,129.99,"Sky Rider Raven Foldable Drone with GPS and Wi-Fi Camera, DRWG538B, Black",6-axis gyroscope for stable hovering and flyingAdjustable angle WiFi cameraGPS compatible2.4GHz remote control4-channel direction control for improved stability,Aerial Drones,3.4,89.0,Sky Rider,76,76,00047323538001,https://i5.walmartimages.com/asr/cb8bc78e-d420-4ef1-bd64-6478a00b2866_1.d3492aff2a1af14185a5ea5f809fe30d.jpeg?odnHeight=200&odnWidth=200&odnBg=ffffff
4WXN6S7C0SPL,10.0,39.99,49.99,SteelSeries Apex 3 Gaming Keyboard,STEELSERIES APEX3 RGB GAMING,Computer Keyboards,4.8,89.0,SteelSeries,304,304,00813682026561,https://i5.walmartimages.com/asr/6da89f0a-01eb-4b04-b671-e59cff21d6b7_1.29428d3c80cecc97da5e6862b313d5bd.jpeg?odnHeight=200&odnWidth=200&odnBg=ffffff
1AT0PNZ8TU16,32.01,67.98,99.99,"Contixo 7"" Kids Tablet 16GB WiFi Android Tablet For Kids Bluetooth Parental Control Pre-Installed Learning Tablet Apps for Toddlers Children Kid-Proof Protective Case, V8-2 Blue","Android 8.1 OS16GB storageKid-Proof Case Against Drops, Bumps20+ Pre-Loaded learning appsAdvanced Parental Controls1.5GHz Quad-core Processor",Tablet Computers,4.6,15449.0,Contixo,4814,4814,00731642719257,https://i5.walmartimages.com/asr/dc57a1a4-0f9d-4c31-ae94-406aaaf4cb31.cddb09a36eb8c5217e736fd04f3cee4e.jpeg?odnHeight=200&odnWidth=200&odnBg=ffffff
71GTLUVHASMG,30.0,59.99,89.99,TP-LINK AC1750 Wi-Fi Range Extender (RE450),Plugs into any outlet for multiple installation points and maximum range extensionExpand and improve your Wi-Fi rangeSimultaneous gaming and 4K HD streaming with AC1750 dual,Signal Repeaters,4.0,218.0,TP-Link,424,424,00845973092405,https://i5.walmartimages.com/asr/d8f73d12-f76a-4bc1-88f8-d46ae0285ad7_1.abb98929af5ea12eaa56226d5dddc263.jpeg?odnHeight=200&odnWidth=200&odnBg=ffffff
3SJJJJMQSIHG,40.0,189.0,229.0,"Gateway 14.1"" Ultra Slim Notebook, FHD, Intel Celeron, Dual Core, 4GB/64GB, Tuned by THX Audio, Mini HDMI, Cortana, 1MP Webcam, Windows 10 S, Microsoft 365 Personal 1-Year Included",short description is not available,Laptop Computers,4.1,89.0,Gateway,0,0,00812550034066,https://i5.walmartimages.com/asr/49bab7c5-fdf7-4ce6-a041-f4518b918338.54e916c89b4c52a747a0121b5ba3617d.jpeg?odnHeight=200&odnWidth=200&odnBg=ffffff
3N8COC094EKG,120.0,169.0,289.0,"Refurbished HP 14"" Pentium 4GB/64GB Chromebook, 14"" HD Display, Intel Pentium Silver N5000, 4GB RAM, 64GB eMMC, Intel UHD Graphics 605, 14a-na0031wm","14"" HD DisplayIntel Pentium Silver N5000 Processor4GB LPDDR4 SDRAMB&O Audio13.5 hours of battery life.MFG Year: 2019",Laptop Computers,3.6,7.0,HP,4438,4438,00194026898359,https://i5.walmartimages.com/asr/617aef72-8c6d-407e-98bb-7edd9a53e8dd.12111924582b6560a929a8a10543d557.jpeg?odnHeight=200&odnWidth=200&odnBg=ffffff
3PV6IXL1ZOPY,100.99,129.0,229.99,"Refurbished SAMSUNG Chromebook 4 11.6"" Intel Celeron Processor N4000 4GB RAM 32GB eMMC Intel UHD Graphics 600 - XE310XBA-K01US","Compact, light design with 11.6"" displayMilitary-grade durabilityUltra-fast connectivity with Gigabit WiFiAdvanced security with multiple layers of built-in virus",Laptop Computers,4.0,49.0,SAMSUNG,7701,7701,00194026888381,https://i5.walmartimages.com/asr/6f54c321-9c3a-4707-9358-0b30ecfff44f.d32656ece805591ef33502c0822a4efd.jpeg?odnHeight=200&odnWidth=200&odnBg=ffffff
4ZLC85KNH2LJ,32.01,67.98,99.99,"Contixo 7 inch Kids Tablet 16GB Android Wi-Fi Camera Bluetooth Learning Tablet for Toddlers Children Kids Place Parental Control Pre-installed Education Apps w/Kid-Proof Protective Case,V8-3-Dark Blue","1GB RAM, 16GB Storage",Tablet Computers,4.7,1215.0,Contixo,1488,1488,00850001962315,https://i5.walmartimages.com/asr/d67b0652-1afb-4abb-8fb7-f819ef171d72.f40f3b2e391f73e39ba408255d808499.jpeg?odnHeight=200&odnWidth=200&odnBg=ffffff
54OY6ONSMWJ5,19.0,25.0,44.0,Sharper Image Instant Camera Kit (Compatible with Fujifilm Instax Mini Film)  Black,Merchandise,Instant Cameras,4.3,73.0,Sharper Image,0,0,00827396542569,https://i5.walmartimages.com/asr/3f3b11fc-8347-4e5d-ab3d-ae086713d36a_1.6e249f00a331ee1e63c92c4526d8ab89.jpeg?odnHeight=200&odnWidth=200&odnBg=ffffff
36D64GS6OZ6F,41.11,68.88,109.99,"Contixo 7"" Kids Tablet 2GB RAM 16GB WiFi Android 10.0 Tablet for Kids Bluetooth Parental Control Pre-Installed Learning Tablet Apps for Toddlers Children Kid-Proof Protective Case","Android 10 OS, 16GB storage1.5GHz Quad-core ProcessorKid-Proof Case Against Drops, BumpsFree Pre-Loaded learning appsAdvanced Parental Controls",Tablet Computers,4.6,3199.0,Contixo,2082,2082,00731642719158,https://i5.walmartimages.com/asr/3a7d5aa9-9b93-4306-9123-f9e821fb7f62_1.09cbf020ce572c5d43262d01dccc24c3.jpeg?odnHeight=200&odnWidth=200&odnBg=ffffff
5Z9M7E7LC8V4,22.0,27.99,49.99,Roku Express+ HD Streaming Media Player 2019 with Voice Remote (Manufacturer Refurbished),"High definition streaming made easy. Plus, Voice remote with TV controls. The Roku Express+ streaming media player delivers a smooth HD streaming experience at a great value. The included voice remote",Streaming Media Players,4.4,173.0,Roku,672,672,00829610004013,https://i5.walmartimages.com/asr/32a2a823-d44b-4982-be82-d9cf83e7e625_1.09a7f552dc04dc47294119be9c6ef6a9.jpeg?odnHeight=200&odnWidth=200&odnBg=ffffff
6IBXPY8O03J9,11.11,38.88,49.99,Jensen CD-545b Portable Stereo CD Player with Cassette Recorder & AM/FM Radio,Top-loading CD playerCD-R/RW compatibleLCD display,Boomboxes,3.9,274.0,Jensen,111,111,00077283965456,https://i5.walmartimages.com/asr/2e8a8a79-e527-4d34-a838-b7ed6e3abd6d_1.c9aafce0d7cfce417b8649b6cda51c2c.jpeg?odnHeight=200&odnWidth=200&odnBg=ffffff
2GSS42QQFCIC,45.0,74.99,119.99,"Contixo 7 inch Kids Tablet 2GB RAM 32GB WiFi Android 10.0 Tablet For Kids Bluetooth Parental Control Pre-Installed Learning Tablet Apps for Toddlers Children Kid-Proof Protective Case, V9-2 Pink","7"" HD 1024x600 Touch ScreenAndroid 10 OSQuad-Core Processor32GB Storage, 2GB RAMBluetooth, Wi-FiParental Controls",Tablet Computers,4.6,553.0,Contixo,772,772,00731642719080,https://i5.walmartimages.com/asr/cb1129d0-1d1b-4836-a939-b3278233050d_1.ca25947f094e82aed85e45d628fb96cb.jpeg?odnHeight=200&odnWidth=200&odnBg=ffffff
5RGDWOJNU3EQ,35.01,114.98,149.99,"Contixo 10 inch Kids Tablet 2GB RAM 16GB WiFi Android 10 Tablet For Kids Bluetooth Parental Control Pre-Installed Learning Tablet Apps for Toddlers Children Kid-Proof Protective Case, K101A Blue",10 inch IPS Display2GB RAM16GBAndroid 10Parental ControlChild-Proof Case,Tablet Computers,4.6,620.0,Contixo,1259,1259,00731642718113,https://i5.walmartimages.com/asr/0204f8e4-f796-4a4f-8b8e-5fac77e1c8a7.363168f5ca1746da2f9f8ece311178f0.jpeg?odnHeight=200&odnWidth=200&odnBg=ffffff
1DUF1T68EAUB,32.01,67.98,99.99,"Contixo 7 inch Kids Tablet Android WiFi Camera 16GB Bluetooth Learning Tablet for Toddlers Children Kids Parental Control Pre-Installed Free Education Apps w/Kid-Proof Protective Case, V8-3-ST Green","7"" 1024 x 600 HD Display1.5GHz Quad-core
 Processor16GB storageBluetooth, Wi-FiPre-Loaded Free Learning AppsAdvanced Parental
 Controls",Tablet Computers,4.6,1317.0,Contixo,3733,3733,00731642718731,https://i5.walmartimages.com/asr/a0adfcde-2cfd-4a85-b50a-6e1605d47d95.3a3550462b0b5de5470a82bd378cb6d7.jpeg?odnHeight=200&odnWidth=200&odnBg=ffffff
1LG9SRBXUHJX,29.0,40.99,69.99,ION Audio Retro Rocker Silver - Portable Retro-Style Compact Boombox Cassette Player with AM/FM Radio,Merchandise,Boomboxes,3.3,3.0,ION Audio,30,30,00842655101417,https://i5.walmartimages.com/asr/327069e4-a70c-4378-992f-f56b6bb3c182_1.441aae94417f26a5b44109203c777e54.jpeg?odnHeight=200&odnWidth=200&odnBg=ffffff
1JX8E9DNBKE8,10.97,39.0,49.97,"Linksys AC1200 Dual Band WiFi 5 Router with Easy Setup, Black",Dual band AC1200 wireless networking WiFi routerEnhanced WiFi speeds up to 1.2 GbpsEasy setup and handles up to 10+ devices at onceIncludes ethernet cable and power,Network Routers,4.1,194.0,Linksys,33196,33196,00745883774005,https://i5.walmartimages.com/asr/19b7872f-65e9-44af-a0f5-bd6c73841e02_1.4c682d38fb3e0b3c12612ad2b7c9a8c6.jpeg?odnHeight=200&odnWidth=200&odnBg=ffffff
43QPMCQG192R,32.01,67.98,99.99,Contixo 7 inch Kids Tablet with WiFi 16GB 20+Education Learning Apps V8-1-Green,"Android 8.1 Go OS16GB storage & 1GB RAMKid-Proof Protective Case Against Drops, Bumps and Thumps",Tablet Computers,4.6,1035.0,Contixo,298,298,00731642724121,https://i5.walmartimages.com/asr/08343b3a-ad09-4352-ad29-01d5c99e9d2b_1.8e909a8bc778a7f113f4a89e20397f62.jpeg?odnHeight=200&odnWidth=200&odnBg=ffffff
3TN9HCS4CB5L,50.01,99.98,149.99,"Contixo 7 inch Kids Learning Tablet Bundle - 16GB Storage, Bluetooth, Android, Dual Cameras, Parental Control, Kids Bluetooth Headphone & 32GB microSD Card, TC-V82-KB-PNK","16GB Storage, Android OS20+ Pre-Loaded Learning AppsAdvanced Parental Controls1.5GHz Quad-core ProcessorFoldable Kids Bluetooth HeadphoneBonus 32GB",Tablet Computers,5.0,1063.0,Contixo,1261,1261,00850001962292,https://i5.walmartimages.com/asr/124df94f-62b5-4a0a-af67-49b06e03335c.4e9dce9a93d03b572588ce9662633b10.jpeg?odnHeight=200&odnWidth=200&odnBg=ffffff
51TYECQFS1I0,15.24,14.75,29.99,"Smart Plug 2 Pack Wifi Enabled Mini Outlets Smart Socket, Compatible with Alexa & Google Assistant, No Hub Required, Timing Outlet Remote Control your Devices from Anywhere","Smart Plug 2 Pack Wifi Enabled Mini Outlets Smart Socket, Compatible with Alexa & Google Assistant, No Hub Required, Timing Outlet Remote Control your Devices from Anywhere",Electrical Outlets,3.8,149.0,Kootion,232,232,00763230621017,https://i5.walmartimages.com/asr/47692115-6670-424a-915c-9a163e7cc3d1_1.6d3ac507e4762f93e92f776af1f03e12.jpeg?odnHeight=200&odnWidth=200&odnBg=ffffff
3SQF0JM3MQE0,20.11,49.88,69.99,Jensen CD-565 Portable CD Music System,"Supports A2DP and AVRCP; Auxilary input jack for connecting an iPod(R), MP3 or other digital audio players; Vertical loading CD player; Skip/search, forward, back and repeat 1 or all; Programmable",Boomboxes,5.0,3.0,Jensen,29,29,00077283935633,https://i5.walmartimages.com/asr/2050be51-fb51-4625-a351-d3b20a03af79_1.74c87ae8dc3fa3741a4b53e00a2640c1.jpeg?odnHeight=200&odnWidth=200&odnBg=ffffff
6I66LAQG3I4I,8.0,36.4,44.4,Jensen CD-490 Portable Stereo CD Player with AM/FM Stereo Radio,Top-loading CD playerCD-R/RW compatibleLED CD track display,Boomboxes,4.1,402.0,Jensen,1193,1193,00077283964916,https://i5.walmartimages.com/asr/a5a36ff3-0849-43d5-a2a8-45ef848a1e20_1.9950a85fb4b9f83c4bd6bf7146d7b7a3.jpeg?odnHeight=200&odnWidth=200&odnBg=ffffff
6S6S4NCCRJSX,160.0,89.99,249.99,"Linsay F10IPKIDSR - Tablet - Android 10 - 32 GB - 10.1"" IPS (1280 x 800) - red","Key Features and Benefits:10.1"" 1280x800 IPS ScreenQuad Core Processor2GB Memory RAM32GB Internal StorageAndroid 10Bundle with Red Kids Defender Case",Tablet Computers,5.0,1.0,Linsay,95,95,00602573713259,https://i5.walmartimages.com/asr/086afb67-17fe-4c12-9fa5-ab4568f4baf5.2b8633147c7adffa5819ddda0586ee95.jpeg?odnHeight=200&odnWidth=200&odnBg=ffffff
38GN4RPKUMC7,45.0,74.99,119.99,"Contixo 7 Inch Kids Tablet 2GB RAM 32GB WiFi Android 10 Tablet for Kids Bluetooth Parental Control Pre-Installed Learning Tablet Apps for Toddlers Children Kid-Proof Protective Case, V9-3 Purple","2GB RAM, 32 GB Storage7"" HD 1024x600 Touch ScreenAndroid 10 OSBluetooth, Wi-FiParental ControlsPre-Loaded Free Learning GameApps
Kid-Proof",Tablet Computers,4.6,426.0,Contixo,1178,1178,00731642719011,https://i5.walmartimages.com/asr/9cad53e3-2ee6-4d76-b028-91c17feb25ef.2d1e7577304887fe13eb1dc6cbb56f57.jpeg?odnHeight=200&odnWidth=200&odnBg=ffffff
19NN13B4WJ2D,122.22,177.77,299.99,"TP-Link Deco M9 Plus (2-pack) | Whole Home Tri-Band Mesh Wifi Router System | up to 2,200 Mbps Speeds","Eliminate weak signal areas with whole-home Wi-Fi. No more searching around for a stable connection. Deco handles traffic from even the busiest networks, providing a lag-free connection for over 100",Network Routers,4.6,28.0,TP-Link,114,114,00845973083175,https://i5.walmartimages.com/asr/48156e92-c591-45f3-a37b-6e80aa15b633_1.c5bae2e38711126c4d85e40514bf0f3d.jpeg?odnHeight=200&odnWidth=200&odnBg=ffffff
2RKFETEW0HOL,20.0,79.99,99.99,ION Audio Street Rocker Black - Portable Retro-Style Stereo Boombox with Wireless Streaming,80s-style retro stereo cassette boomboxDual full-range speakers pump out powerful bass and clear highs14 watts output powerStreams music from any Bluetooth-enabled,Boomboxes,3.0,3.0,ION Audio,38,38,00842655101158,https://i5.walmartimages.com/asr/bf855aca-3b0e-42ea-8aca-b175e4f0463e_1.be2d7efa780657e0cc343f420d21a753.jpeg?odnHeight=200&odnWidth=200&odnBg=ffffff
24MIWV01JBI1,32.01,67.98,99.99,"Contixo 7"" Kids Learning Tablet Android Bluetooth WiFi Camera for Children Toddlers Kids Parental Control Pre-Installed Educational Game Apps w/Kid-Proof Protective Case, V8-2-Orange",Android 8.1 Go OS16GB storage & 1GB RAMKid-Proof Case Against Drops and Bumps20+ Pre-Loaded educational apps/gamesAdvanced Parental Controls,Tablet Computers,4.6,1327.0,Contixo,249,249,00731642723926,https://i5.walmartimages.com/asr/61cf6928-f569-4f76-bc81-c9da9fda2686.cd52e45212d32d5c459785fc5c80668f.jpeg?odnHeight=200&odnWidth=200&odnBg=ffffff
51E3M7SWR4IV,6.52,52.48,59.0,"D-Link HD Wi-Fi Indoor Security Camera (DCS-8010LH-WM), Qty 1",HD Quality Video with Night VisionSound & Motion DetectionLocal & Cloud Recording Options,Surveillance Cameras,4.0,62.0,D-Link,62,62,00790069437618,https://i5.walmartimages.com/asr/1db3b1fe-c0e0-4ea7-b87f-bd49473d5e5e.a3abf3e09f98ab8570b737f7169b66ef.png?odnHeight=200&odnWidth=200&odnBg=ffffff
4HI76TVHZK4Y,9.0,40.99,49.99,"ION ISP113ASL '80s-Style Retro Rocker 2 6-Watt Portable Compact Boombox with AM/FM/Shortwave Radio, Cassette Player, and Bluetooth","- AM, FM, Shortwave Tuners- Bluetooth Audio Streaming- Bass and Treble Adjustment- Cassette Playback and Recording- USB & SD Recording",Boomboxes,0.0,0.0,"ION Audio', 'iON",20,20,00842655102575,https://i5.walmartimages.com/asr/484f19be-77aa-4b23-a017-6b438c4c11ae.26a2e0c55d5275fd6b0afa773ac18650.jpeg?odnHeight=200&odnWidth=200&odnBg=ffffff
1AVIN0QX0AFF,35.01,114.98,149.99,"Contixo 10 inch Kids Tablet 2GB RAM 16GB Android 10 for Toddlers Children, K101 Blue","Android 9.0 OS16GB storage2GB RAMKid-Proof Case Against Drops, Bumps20+ Pre-Loaded learning appsAdvanced Parental Control",Tablet Computers,4.7,797.0,Contixo,311,311,00731642718991,https://i5.walmartimages.com/asr/66f8e0ff-2e42-4cc3-9fdd-e46e245b6ec4.ebdfc4698ac17403c17129e32712b8ee.jpeg?odnHeight=200&odnWidth=200&odnBg=ffffff
6N5NQ4WRTAQR,24.0,65.99,89.99,Q768 7 inch Kids Tablet Educational Learning Computer 1024*600 Resolution WiFi Connection with Silicone Case Green Plug,Q768 7 inch Kids Tablet Educational Learning Computer 1024*600 Resolution WiFi Connection with Silicone Case Green Plug,Tablet Computers,4.3,6.0,Ametoys,8,8,00791351396347,https://i5.walmartimages.com/asr/c9bb2fb8-a05d-44bf-8199-fe25313eb359_1.7fc24cc7c0ea99fd5dd9cd65afc6ea0a.jpeg?odnHeight=200&odnWidth=200&odnBg=ffffff
5VVW9LPIL38H,9.65,14.88,24.53,Philips Hue White A19 60W Smart Dimmable LED Bulb - White,Philips Hue A19 Medium Dimmable LED Light Bulb,Light Bulbs,5.0,1.0,Philips Hue,11,11,00046677530341,https://i5.walmartimages.com/asr/1a159a1b-acda-4a6a-b222-99d596e6f366_1.3eac199fb6cd1d48c0a5b7500c53a4e3.jpeg?odnHeight=200&odnWidth=200&odnBg=ffffff
5BY1RJ5MTP15,5.78,42.66,48.44,Jensen CD-575 Portable Stereo MP3 CD Player With Pll AM/FM Radio,Jensen Cd-575 Portable Stereo Cd Player,Boomboxes,3.7,52.0,Jensen,1310,1310,00077283965715,https://i5.walmartimages.com/asr/7724a891-49af-4cf5-87a2-645af09efe60_1.ffed656a59b78359cfb7b17d32297ea4.png?odnHeight=200&odnWidth=200&odnBg=ffffff
4S67AT2DVCWH,11.38,38.61,49.99,Jensen Cd-475 Portable Stereo Cd Player With Am/fm Radio,Top-loading CD playerCD-R/RW compatibleLED CD track display,Boomboxes,3.5,93.0,Jensen,122,122,00077283864728,https://i5.walmartimages.com/asr/f829fffd-6f58-4821-96be-7d3fe2c1b347_1.7dd2d35fd517a207aefe193b7b7fad26.jpeg?odnHeight=200&odnWidth=200&odnBg=ffffff
2553234V29IL,20.0,79.0,99.0,"Belkin Dual Band AX1800 Wifi 6 Router, 1.8 Gbps, White (RT1800)","Dual band AX1800 wireless networking to handle 20+ devicesEnhanced WiFi speeds up to 1.8 GbpsCovers up to 1,500 sq ftWPA3 security, guest access, and parental controls",Network Routers,4.5,151.0,Belkin,8681,8681,00745883811571,https://i5.walmartimages.com/asr/96cffb9f-f248-4228-a328-f02cd895e7df.39ce47f4440fd0bd15ab1dba5db686be.jpeg?odnHeight=200&odnWidth=200&odnBg=ffffff
1VK783I42DBX,6.0,53.0,59.0,Corsair Void Elite Stereo Gaming Headset,Corsair Void Elite Stereo,Headsets,4.0,29.0,Corsair,400,400,00840006618744,https://i5.walmartimages.com/asr/c79ba519-917c-4fce-902c-2ef52ce0dbd8.c71e74205899e503249f02aa1a10fae9.png?odnHeight=200&odnWidth=200&odnBg=ffffff
385P31965USY,10.0,69.0,79.0,Razer Ornata Chroma - Mecha-Membrane Gaming Keyboard.,Razer Ornata Chroma Mechanical Membrane Keyboard,Computer Keyboards,4.7,37.0,Razer,142,142,00814855022670,https://i5.walmartimages.com/asr/0ce855a2-dcb7-4d0a-9884-040cf496263a_1.ad606ddbca2fe908713dca4ae13e4134.jpeg?odnHeight=200&odnWidth=200&odnBg=ffffff
1HJYMYZAJ8CP,190.0,259.99,449.99,Defender 4k Ultra HD Indoor & Outdoor Security Cameras Night Vision Mobile Viewing Motion Detection Cameras  Security for Home and Business (4 Cameras),4K Resolution Security Camera SystemMobile Viewing and RecordingNo Monthly Fees,Surveillance Cameras,4.5,613.0,Defender,637,637,00842751000034,https://i5.walmartimages.com/asr/6f466fb4-c4fa-425a-b561-270913b35859.cc3b08018b3c964e33945dccc9b5e3ad.jpeg?odnHeight=200&odnWidth=200&odnBg=ffffff
44WN7JES71BS,12.0,37.99,49.99,Supersonic SC-3201BT-WD Retro 4-Band Radio and Cassette Player With (Wood),AM/FM/SW 1-2 world band receiver ; Cassette player ; Bluetooth(R) for streaming audio from compatible Bluetooth(R)-enabled devices; Built-in USB port and SD(TM) Card slot; MP3 playback ; 4 watt,Portable Radios,3.6,14.0,Supersonic,1333,1333,00639131632011,https://i5.walmartimages.com/asr/0df6c675-21c8-438c-a100-e8c7bd564ac5_1.7f7c1227b7cc4a6db363b0f8e6b36b51.jpeg?odnHeight=200&odnWidth=200&odnBg=ffffff
3D30P4TRR7A0,8.04,56.95,64.99,"ASUS PCE-AC56 Dual-Band AC1300 Wireless PCI-E Adapter with Heat Sink, Detachable Antennas",Key Features and Benefits:The easy way to upgrade any desktop PC to super-fast next-generation 802.11ac Wi-FiThe ASUS PCE-AC56 is a 802.11ac Wi-Fi PCI Express adapter which upgrades your desktop,Network Adapters,4.7,6.0,ASUS,520,520,00886227504763,https://i5.walmartimages.com/asr/1936c095-5c1f-479f-87d4-8e9d2e0e2b7c_1.7cf7de8b9931169b399b5ae58aed4e5d.jpeg?odnHeight=200&odnWidth=200&odnBg=ffffff
3GMTA1ZQUR79,10.0,69.99,79.99,HyperX Cloud Stinger Core Wireless 7.1 Gaming Headset for PC,Gaming-Grade Wireless with 7.1 Surround Sound: The wireless Cloud Stinger Core features a solid 2.4GHz gaming-grade wireless connection that provides freedom from cords in addition to 7.1 surround,Headsets,4.3,12.0,HyperX,5962,5962,00740617299809,https://i5.walmartimages.com/asr/46187f76-aea8-4496-994e-45c7046e1d2b.367aa136748ede85453413398ba8b21c.jpeg?odnHeight=200&odnWidth=200&odnBg=ffffff
2W1OF15FU56W,15.72,94.27,109.99,HyperX Alloy Origins - Mechanical Gaming Keyboard - Software-Controlled Light & Macro Customization - Compact Form Factor - Linear Switch - HyperX Red - RGB LED Backlit,HYPERXALLOY ORIGINS MECHANICAL,Computer Keyboards,5.0,10.0,HyperX,7443,7443,00740617288551,https://i5.walmartimages.com/asr/26b3ebce-52b3-439d-936b-51d10f2cd634_1.367b64c381e15b52d9fbb7e5adf9b896.jpeg?odnHeight=200&odnWidth=200&odnBg=ffffff
15XZCXR9YDH3,10.0,29.99,39.99,"Link2Home Wireless Remote Control Electrical Outlet Switch for Household Appliances and Electronics; 5 Outlets, 2 Remotes","Easily turn ON/OFF electric devices all with the push of a buttonGreat for hard to reach appliances/devices and those with limited mobilityStrong operating range, up to 150'",Electrical Outlets,4.4,22.0,Link2Home,69,69,00818445020015,https://i5.walmartimages.com/asr/864051f5-6d1b-4fe3-9215-e70551b63ef9_1.0c52fb73b8cb0751d05dfa2b9b05f46b.jpeg?odnHeight=200&odnWidth=200&odnBg=ffffff
5ZCUWXVN8YN7,4.5,10.99,15.49,"Xiaomi Mi Smart Plug, 1-Pack",No hub requiredWork with Google AssistantWifi supported,Electrical Outlets,3.6,68.0,Xiaomi,875,875,00190997000678,https://i5.walmartimages.com/asr/13097a8a-2d19-466e-ba31-43590d767d00_1.5cd4706f4f787ff952243eb80ed36878.jpeg?odnHeight=200&odnWidth=200&odnBg=ffffff
1LDH2T3NW3LS,40.99,109.0,149.99,"SAMSUNG Galaxy Tab A Kids Edition 8"" 32GB WiFi Tablet Silver - SM-T290NZSKXAR",Screen/Display size : 8||Hard Drive/Data Storage : 2||Processor Cores : Quad Core,Tablet Computers,4.2,46.0,SAMSUNG,0,0,00887276355115,https://i5.walmartimages.com/asr/6150fbfa-e562-4be3-a496-f37f2307e235_1.b897477017306dcbf186b9329756108c.jpeg?odnHeight=200&odnWidth=200&odnBg=ffffff
6YALYAQX1X7M,90.0,189.99,279.99,Defender Ultra HD 4K (8MP) 1TB Outdoor Wired Security Camera System with 2 Night Vision Cameras for Home & Business,4K Ultra HD Security Surveillance System 2 Cameras,Surveillance Cameras,4.6,474.0,Defender,653,653,00842751000164,https://i5.walmartimages.com/asr/664337f0-ea81-4fed-8555-776c45ded376.7a22eb5042a28aab01c22107104f2850.jpeg?odnHeight=200&odnWidth=200&odnBg=ffffff
69DEB9CX92N7,60.0,99.99,159.99,"MobiCam DXR-M1 Baby Monitoring System w/ Smart Auto Tracking, Room temperature, Lullabies","Plug and play - ready to use, no setup required.Monitor securely and smoothly up to 1000ft away.Two-way audio allows for talkback and listening.View perfectly in total",Baby Monitors,4.3,21.0,MOBI,329,329,00891040702012,https://i5.walmartimages.com/asr/268ab5d0-3302-47b8-824a-81ed59c1d770_4.9d740aef1de4b1a5ff6fc2ab46fdf611.png?odnHeight=200&odnWidth=200&odnBg=ffffff
1JNC4KI9DNMM,100.0,499.99,599.99,Xiaomi Compact Smart Projector (1080p HD) Powered by Android TV,Mi Smart Compact Projector is a perfect choice as your home entertainment center. It delivers up to 120 inches of full HD quality image. The projector uses an LED light source with a brightness of up,Streaming Media Players,4.8,11.0,Xiaomi,35,35,00190997000814,https://i5.walmartimages.com/asr/a3300e2c-c50d-42e2-8fb2-1449ba491637.e296ab99084eaba06147d921a05f7766.jpeg?odnHeight=200&odnWidth=200&odnBg=ffffff
2IR3LZVYIMUP,30.0,169.99,199.99,"August Smart Lock + Connect, Satin Nickel","Features: -Total control. Lock and unlock your door, grant keyless access and keep track of who comes and goes, all from your August App.. -Upgrade your existing lock. Simply attaches to your existing",Hardware Locks,4.0,67.0,August Home,92,92,00853984006809,https://i5.walmartimages.com/asr/cc19de7f-bf1d-4369-a698-169c06bb3658_1.31ac54f413a1868797ee44be3e4732df.jpeg?odnHeight=200&odnWidth=200&odnBg=ffffff
1G3WO3K1QZ6V,7.99,22.0,29.99,"Corsair Gaming HARPOON RGB Gaming Mouse, Backlit RGB LED, 6000 DPI, Optical",Corsair HARPOON RGB Optical Gaming Mouse CH-9301011-NA,Computer Mice,4.2,50.0,Corsair,688,688,00843591088893,https://i5.walmartimages.com/asr/56879326-0643-4d93-943b-28d6b6794517_1.31144c3296dab14c6a4f561d89037b45.jpeg?odnHeight=200&odnWidth=200&odnBg=ffffff
1XR3U9QBAL8J,20.0,179.99,199.99,"SkylinkNet Smart Home Security Alarm System Kit Model SK-240 with Wireless Camera, Compatible with Alexa, Google Assistant and IFTTT",,default,4.7,278.0,Skylink,86,86,00623459201264,https://i5.walmartimages.com/asr/e4444157-c997-485a-8d71-6bd5871359af.bb725ba9e04b2991ae8eabc759ca763c.jpeg?odnHeight=200&odnWidth=200&odnBg=ffffff
1YPW1JCBZL1Y,10.0,29.99,39.99,HyperX Cloud Stinger Core Gaming Headset for PC,"Lightweight comfort; Immersive in-game audio; Durable, adjustable steel sliders; Convenient in-line audio controls; Noise-cancelling adjustable mic; Multi-platform compatibility",Headsets,4.7,22.0,HyperX,5540,5540,00740617291728,https://i5.walmartimages.com/asr/929a302f-faae-4406-99ef-8a9ee69cf5fc_1.90e00d5440f7827ce0e7a70757c10782.jpeg?odnHeight=200&odnWidth=200&odnBg=ffffff
4EYHDE6TXXYO,60.0,169.99,229.99,"Acer 24"" 1080p DP HDMI DVI 144Hz 1ms NVIDIA GSYNC HD LCD Monitor - XF240H bmjdpr","24"" diagonal LED LCD screen16:9 aspect ratio1920 x 1080 resolutionCapable of displaying millions of colors",Computer Monitors,4.5,16.0,Acer,386,386,00888863618637,https://i5.walmartimages.com/asr/f2cfe98d-7aa6-4dd4-852e-e0ec675e595d_1.8db03eaaf23b9c48e1a73f7d0c8fc9bd.jpeg?odnHeight=200&odnWidth=200&odnBg=ffffff
