productId,Savings$,Sale_price$,Orig_price$,Item,description,productCategory,customerRating,numReviews,brand,initialQuantity,quantity,standardUpc,imageUrl
28SLRV28A8NG,700.0,4297.99,4997.99,"SAMSUNG 65"" Class the Terrace Outdoor QLED 4K Smart TV with HDR QN65LST7TAFXZA 2020",Outdoor-optimized QLED pictureHigh-quality 4K QLED picture engineered to look incredibly vivid and bright especially in daylightIP55 rated weather-resistant durability,Televisions,4.7,76.0,SAMSUNG,41,41,00887276421360,https://i5.walmartimages.com/asr/7b957fbc-06c2-4852-a2a4-b66ee1a4fed8.2a4b6d27d2956bb34863af0d6b7f84d6.jpeg?odnHeight=200&odnWidth=200&odnBg=ffffff
2FOWVD1RFR4U,60.0,299.0,359.0,"Night Owl 12 Channel 4K Wired DVR, 4 Wired Light Cameras & 1TB HDD",4K Ultra HD Wired Video Security System with Pre-Installed Hard Disk Drive4K Ultra HD Wired Indoor/Outdoor Spotlight CamerasEnhanced Security and Privacy using 2-Step,Surveillance Cameras,4.7,223.0,Night Owl,114,114,00816522023560,https://i5.walmartimages.com/asr/22a23ac4-6fa8-46dd-b642-91913b6fb66e.d7a6df7c03945b052bc9372cca35abbe.jpeg?odnHeight=200&odnWidth=200&odnBg=ffffff
70YJ8WXUTUYW,120.0,679.0,799.0,"HP Pavilion Gaming 16"" FHD, Intel Core i5-10300H Processor, NVIDIA GeForce GTX 1650, 8GB RAM, 256GB SSD,16-a0051wm","Windows 10 Home with discrete NVIDIA GeForce GTX 1650 10th Generation Intel Core i5-10300H Processor, Quad-Core, 2.5 GHz up to 4.5 GHz Up to 5.25 hours mixed usage, 7.5 hours video playback, 5.5 hours",Laptop Computers,4.2,10.0,HP,1238,1238,00195122814045,https://i5.walmartimages.com/asr/69b3de7d-a1a1-4358-ba71-69ba88d39bc5.15cf90c9c78396ba9672ea2b560ed93e.jpeg?odnHeight=200&odnWidth=200&odnBg=ffffff
5QP622JGKMW7,20.99,79.0,99.99,LG 2.0 Channel 40W Compact Soundbar - SK1,Compact DesignBluetooth StreamingTV Remote Compatibility,Sound Bars,4.0,113.0,LG,1265,1265,00719192620100,https://i5.walmartimages.com/asr/ff8eb124-c510-4a3e-a074-5af72012a38f_1.f54660de894f356941daab6e761fbd2e.jpeg?odnHeight=200&odnWidth=200&odnBg=ffffff
597HY653BMDU,30.0,239.0,269.0,"VANKYO Performance V630W Native 1080P Projector, Full HD 5G Wifi Projector with LCD Display","2.4G/5G Wireless SynchronizationNative 1080P Full HD Projector50 4D Keystone CorrectionGiant Cinematic 300"" WidescreenCustomized Multimedia Connection",Video Projectors,4.6,14.0,VANKYO,233,233,00810051301496,https://i5.walmartimages.com/asr/ad59c0b5-46f8-4c6d-9a56-d00c8d9ae05e.34dda6c269745ac4ddde253520351d75.jpeg?odnHeight=200&odnWidth=200&odnBg=ffffff
4JVY0TBGM7TV,20.0,119.0,139.0,NETGEAR - Nighthawk R6900 AC1900 Smart WiFi Router,"1,800 sq. ft. of WiFi CoverageConnect 30+ devices at onceStrong WiFi for all your devices",Network Routers,4.9,12818.0,NETGEAR,957,957,00606449119817,https://i5.walmartimages.com/asr/8a7d06ca-8f36-48b5-b915-bc756a76e3d7.dd5efcc80a833b3c9a3e387189e1feb2.png?odnHeight=200&odnWidth=200&odnBg=ffffff
2N91GB0PCEYB,150.0,239.0,389.0,"SIMPLE Mobile Apple iPhone XR, 64GB, Coral - Prepaid Smartphone + SM $40 UNLIMITED","12MP Wide cameraDigital zoom up to 5x6.1 all-screen LCD Multi-Touch displayCoverage on a lightning-fast nationwide network*Compatible with Truly Unlimited talk,",Cell Phones,5.0,1.0,Apple,104,104,00616960433705,https://i5.walmartimages.com/asr/fbeb9894-39ad-4cd8-b945-e04233d1310e.1614c84fd73389771aca1c3013c71397.jpeg?odnHeight=200&odnWidth=200&odnBg=ffffff
0T84YZ9HXVPO,360.99,1239.0,1599.99,Epson Home Cinema 4010 4K PRO-UHD Projector with Advanced 3-Chip Design and HDR (Refurbished),"
Epson 4K PRO UHD delivers an amazing 4K UHD experience with advanced pixel-shifting resolution-enhancement technology1 for your DIY home theater

HDR High Dynamic Range and Rich Black",Video Projectors,0.0,0.0,Epson,37,37,00010343944084,https://i5.walmartimages.com/asr/8b0ffdad-9f58-4217-85f8-659904db0f3d.619b11773cc7d9a15c4c192e5a74e845.jpeg?odnHeight=200&odnWidth=200&odnBg=ffffff
3CLQ9U5XA7SI,100.0,349.99,449.99,NETGEAR - Orbi RBK752 AX4200 Tri-Band Mesh WiFi 6 System with Router and 1 Satellite Extender,"5,000 sq. ft. of WiFi 6 CoverageConnect 40+ devices at onceSeamless 4k streaming in every room, on all your devices",Network Routers,4.8,2441.0,NETGEAR,657,657,00606449146165,https://i5.walmartimages.com/asr/226b2a73-66b1-4848-9ef5-10a0b401bf7e.022f767be974899367b76cebac17b625.jpeg?odnHeight=200&odnWidth=200&odnBg=ffffff
53L0RSJDSGXC,39.46,29.88,69.34,"Tracfone LG Journey, 32GB, Black - Prepaid Smartphone","LG Journey 5.45"" 32GB Storage 2GB RAM Black Tracfone 4G LTE Prepaid Smartphone TFLGL322DCPCarve your own path with the LG Journey LTE. This smartphone is stocked with all the essentials including",Cell Phones,4.0,463.0,LG,1019,1019,00616960331988,https://i5.walmartimages.com/asr/dd11bbf8-9eb6-44a2-b65e-e53524973935_1.e625373cf9f15f3d39a206009e5a2c30.jpeg?odnHeight=200&odnWidth=200&odnBg=ffffff
6DESCE8DAB4W,100.0,249.0,349.0,"AT&T Apple iPhone SE20X, 64GB, Black - Prepaid Smartphone",Merchandise,Cell Phones,4.0,189.0,Apple,534,534,00194252148662,https://i5.walmartimages.com/asr/6ac861b1-39b7-49f2-b59c-f84054ebce4f.509dba035dc9b74987eff023fc04714d.jpeg?odnHeight=200&odnWidth=200&odnBg=ffffff
7498L2BR3GA1,210.99,349.0,559.99,"EVOO 14.1 Ultra Slim Notebook - Elite Series, FHD Display, AMD Ryzen 5 3500U Processor with Radeon Vega 8 Graphics, 8GB RAM, 256GB SSD, HD Webcam, Windows 10 Home,","Windows 10 Home14.1 FHD Display, 1920 x 1080, 60HzAMD Ryzen 5 3500U Mobile Processor with Radeon Vega 8 Graphics (2.1GHz, Up to 3.7GHz)",Laptop Computers,3.5,2.0,EVOO,2225,2225,00812550033830,https://i5.walmartimages.com/asr/6395bc8e-fd92-4b93-8715-c52cb7563c8a.4de333ceaa4fdd8227bb41742ab4a844.jpeg?odnHeight=200&odnWidth=200&odnBg=ffffff
2F4VOO31KVK5,200.99,199.0,399.99,"Philips PB603 Dolby Atmos Soundbar Speaker 3.1 Channel with Wireless Subwoofer, 300W (TAPB603)",Philips PB603 Dolby Atmos 3.1 channel soundbar speaker with wireless subwooferEnjoy a cinematic experience right at home with Dolby Atmos sound that creates a 3D listening experience,Sound Bars,4.4,34.0,Philips,463,463,00840063200500,https://i5.walmartimages.com/asr/df63a207-5740-442c-b90b-d14d962fbe9a.0ec531ed39c0c357f48c2935cdd5704c.jpeg?odnHeight=200&odnWidth=200&odnBg=ffffff
2JBPZG4MPXUG,702.0,1297.99,1999.99,"SAMSUNG 43"" Class 4K UHD (2160p) The Sero HDR Smart QLED TV QN43LS05TA 2020",SAMQN43LS05TAThe Frame 3.0 QLED Smart 4K UHD TV (2020 Model)The Frame Standard Smart Remote (TM2050A - White)Remote Control BatteryPower CableUser Manual,Televisions,4.5,62.0,SAMSUNG,63,63,00887276411507,https://i5.walmartimages.com/asr/85bf7f3d-040d-4046-a966-9b1b1fb443f1.d461f287afd2ff62ed406105f38f995a.jpeg?odnHeight=200&odnWidth=200&odnBg=ffffff
748VN6WD3MKP,150.0,199.0,349.0,Total Wireless Apple iPhone SE (2020) w/ 64GB,,Cell Phones,4.2,53.0,Apple,11,11,00616960376965,https://i5.walmartimages.com/asr/be2f1b07-2634-479f-9b9b-c767af455fbb_2.dd8d9aaa2f1ff829e5a2e4f9d268c486.jpeg?odnHeight=200&odnWidth=200&odnBg=ffffff
2S5JVH48ZUKI,15.0,92.99,107.99,Toshiba Canvio Advance 4TB Portable External Hard Drive USB 3.0 Black - HDTC940XK3CA,Toshiba Canvio Advance Portable External Hard Drive 4TB Black2-year limited warranty,Hard Drives,4.7,23.0,Toshiba,529,529,00723844000424,https://i5.walmartimages.com/asr/e6bef4fa-1210-40b5-9d8f-715597c271d4_1.c88b4478ae38380b66c2dfd9d34b16dc.png?odnHeight=200&odnWidth=200&odnBg=ffffff
6J3WC77RNRGN,30.0,199.0,229.0,"HP 11"" Touch Chromebook, Celeron N3350,  4GB RAM, 32GB emmc, Grey/Blue, Chrome, 11a-nd0100wm","Chrome with integrated Intel HD 500 Graphics Intel Celeron N3350, Dual-Core, 1.1 GHz up to 2.4 GHz Up to 11 hours mixed usage HD touchscreen, access to Android apps, Google Assistant and Stadia 2",Laptop Computers,0.0,0.0,HP,4960,4960,00195908415152,https://i5.walmartimages.com/asr/c428e080-af0b-405d-ac54-a9636f3903de.9fdc7b46c159fb035a107c113da341bc.jpeg?odnHeight=200&odnWidth=200&odnBg=ffffff
0SJ0KAY6QNS5,4.0,20.88,24.88,"onn. Tilting TV Wall Mount for TVs 50""-86""","Supports 47""-86"" TVsHolds up to 120 lbs (54.4 kg)Positions TV approximately 2 in (5.1 cm) from wall",TV & Monitor Mounts,4.8,151.0,onn.,3627,3627,00681131308434,https://i5.walmartimages.com/asr/60c2fc40-e352-44cc-8e86-86faeb0140fc.c995657eae4fb73d878e0d5190dc39bf.png?odnHeight=200&odnWidth=200&odnBg=ffffff
4I2AREZL032T,1000.0,5497.99,6497.99,"SAMSUNG 75"" Class the Terrace Outdoor QLED 4K Smart TV with HDR QN75LST7TA","SAMQN75LST7TAQN75LST7TA 75"" The Terrace QLED 4K UHD HDR Smart TvRemote Control BatteryPower CableUser ManualE-ManualIncludes Samsung Authorized USA",Televisions,4.7,75.0,SAMSUNG,38,38,00887276421377,https://i5.walmartimages.com/asr/1b3faf8d-7152-4c36-9bb0-6e5dda120efc.f540924e977e779fc3e7b3003bacd3bc.jpeg?odnHeight=200&odnWidth=200&odnBg=ffffff
24AK76GXNGH5,49.01,249.99,299.0,Boost Mobile Apple iPhone SE,Brightstar Distrib Boost Iphone Se 2 Black,Cell Phones,3.2,19.0,Apple,783,783,00190199735033,https://i5.walmartimages.com/asr/959387df-c57b-4527-afe0-17bf4676bc73.d52471c5536151f3409c131b7fabe89c.jpeg?odnHeight=200&odnWidth=200&odnBg=ffffff
5B556MCSRZ68,70.0,329.0,399.0,"HP X360 14"" Pentium Touch 4GB/128GB Chromebook, 14"" HD Touch Display, Intel Pentium Silver N5000, 4GB RAM, 128GB eMMC, Intel UHD Graphics 600, 14b-ca0061wm","Chrome with integrated Intel UHD Graphics 600Intel Pentium Silver N5000 Processor, Quad-Core 1.1 GHz up to 2.7 GHzUp to 12 hours mixed usageMicro-edge bezel touchscreen",Laptop Computers,4.2,634.0,HP,3661,3661,00194850054747,https://i5.walmartimages.com/asr/5e81537c-f54e-4411-8491-8dd233911427.f62656b897a7415f27ce77a4019d6e06.jpeg?odnHeight=200&odnWidth=200&odnBg=ffffff
4U985US7WXAW,72.0,527.99,599.99,"SAMSUNG 32"" Class The Frame Full HD QLED Smart TV with HDR QN32LS03TBFXZA 2020","32"" QLED 1080p 60Hz Edge Lit The Frame Smart TV 3 HMDI ports Color Volume 100% (Quantum Dot) Quantum 4K Processor with AI Upscaling Art Store 3.0 Ambient Mode Included Accessory: Smart Remote and No",Televisions,4.4,528.0,SAMSUNG,309,309,00887276416175,https://i5.walmartimages.com/asr/ff599c00-321f-4779-92d2-3d632d72b177.0cf2075cc504fa1be7d83778e5c1d5bb.jpeg?odnHeight=200&odnWidth=200&odnBg=ffffff
1R4JIB8AQ1CD,21.03,26.93,47.96,"onn. Full Motion TV Wall Mount for TVs 47-84"", Dual Swivel Articulating Arms","Supports 47""- 84"" TVsHolds up to 100 lbs (45.5 kg)Mounts to either 16 in or 24 in wall studs",TV & Monitor Mounts,4.7,587.0,onn.,904,904,00681131308458,https://i5.walmartimages.com/asr/96690f6c-f4ce-4cc5-b755-c9c303bd9b9b.5f142094f308dc13e5148bd8d5e40041.jpeg?odnHeight=200&odnWidth=200&odnBg=ffffff
479BIF4UUWO3,70.99,329.0,399.99,"Acer Spin 513 Qualcomm 4GB/64GB Chromebook, 13.3"" Full HD IPS Multi-Touch Corning Gorilla Glass Display, Qualcomm Snapdragon 7c Compute Platform, 4GB LPDDR4X, 64GB eMMC, CP513-1H-S60F",Acer Spin 513 Qualcomm 4gb/64gb Chrome,Laptop Computers,3.5,4.0,Acer,574,574,00195133096720,https://i5.walmartimages.com/asr/87ca8715-029f-4aa3-a2bf-7fb689a0e168.ee27f523152c236eb565f3a584981ffc.jpeg?odnHeight=200&odnWidth=200&odnBg=ffffff
2SAA424BCWZT,32.0,147.99,179.99,"Panasonic DP-UB150-K 4K Ultra HD Dolby Atmos Audio DVD/CD/3D Blu-ray Player - supports WAV, WMA, AAC, AIFF, MP3, FLAC, DSF, DSD, ALAC, DFF, MPEG-2, MKV, H.264, AVCHD, HEVC, BDAV, and MP4 formats-Black","Plays 4K Ultra HD movies at 4x the resolution of full 1080p HD, letting you watch your favorite scenes with a level of detail and clarity like never beforeHigh Resolution audio",Blu Ray & DVD Players,4.8,8.0,Panasonic,115,115,00885170420175,https://i5.walmartimages.com/asr/22f1ce37-e228-43a8-bafa-30c6c66bede7.ae4e58604cd18c0bceaa314ef7e5689c.jpeg?odnHeight=200&odnWidth=200&odnBg=ffffff
5ZPI1I6PUP36,20.0,129.0,149.0,"TP-Link WiFi 6 Mesh Router Replacement System | 2- AX1800 Mesh Routers | Coverage up to 4,000 Sq ft.","Works with any internet service provider, Deco W3600 uses powerful Wi-Fi 6 and TP-Link Mesh technology to blanket your home in strong and reliable WiFi everywhere, up to 4,000 sq ft.",Network Routers,4.4,163.0,TP-Link,537,537,00840030701146,https://i5.walmartimages.com/asr/023ebd2f-c509-4d82-89de-068f3f3c75d8_1.97df89cdf82c78b2fdf1b221916ce639.png?odnHeight=200&odnWidth=200&odnBg=ffffff
306DE13HTAJM,20.99,149.0,169.99,KODAK PIXPRO AZ401 Bridge Digital Camera - 16MP 40X Optical Zoom HD720p video (Red),"16 megapixel resolution24-960mm zoom lens3"" LCD screen",Digital Cameras,4.1,179.0,Kodak,1535,1535,00819900013207,https://i5.walmartimages.com/asr/145d8619-539e-493b-bd1c-fd60a39461e7_3.95789ce506fa9218704ce7b3fcc69ebe.jpeg?odnHeight=200&odnWidth=200&odnBg=ffffff
7AGZ4Z6EO77S,7.0,62.99,69.99,Seagate 2TB Expansion 3.0 USB Portable External Hard Drive - STEA2000400,"2TB storage capacity lets you take a variety of music, films, presentations and other files with you on the goUSB 3.0 interface is also backwards compatible with USB 2.0 for simple",Hard Drives,4.5,518.0,Seagate,9853,9853,00763649064887,https://i5.walmartimages.com/asr/9ce06bc7-0c3f-4ab7-9a03-1b50af833e6e_1.dc79511c48e363849e3ed9e31480385a.jpeg?odnHeight=200&odnWidth=200&odnBg=ffffff
5OVYBQIYRFOO,12.52,49.97,62.49,Seagate Portable USB 3.0 (Capacity),Seagate Backup Plus Slim STHN1000400 1 TB Hard Drive - External - Portable,Hard Drives,4.6,82.0,Seagate,269,269,00763649134177,https://i5.walmartimages.com/asr/4b752daa-5146-4fa8-8b78-122cb8531582_1.71400b6ed77c22f36a74a5384fe6c423.jpeg?odnHeight=200&odnWidth=200&odnBg=ffffff
2ED4L91KGIV4,80.0,99.0,179.0,"Walmart Family Mobile Samsung Galaxy A11, 32GB Black - Prepaid Smartphone","With its long-lasting, fast-charging battery, you'll have plenty of juice for whatever life throws your way. Capture the perfect shot with ease thanks to the triple lens camera. Plus, it all looks",Cell Phones,3.5,20.0,SAMSUNG,1070,1070,00616960378525,https://i5.walmartimages.com/asr/976cc1ac-7bdd-4a3e-84ea-f3a6e720d8b3.69e3fc1624f33422f2b792ac27dfd10c.jpeg?odnHeight=200&odnWidth=200&odnBg=ffffff
1KLKUPCV53IV,40.0,149.0,189.0,"ARRIS SURFboard DOCSIS 3.1 Gigabit Cable Modem, Approved for Cox, Xfinity, Spectrum & others",Capable of the fastest download speeds available from cable providersDOCSIS 3.1 cable modem2 x Gigabit Ethernet ports,Modems,4.2,143.0,ARRIS,1784,1784,00612572211373,https://i5.walmartimages.com/asr/c85e835f-57ff-42a4-adc7-99396b5ccc92_1.da9253415da4274aa8e8e105ebc50aa7.jpeg?odnHeight=200&odnWidth=200&odnBg=ffffff
0VI1UHEBZYES,14.0,65.0,79.0,"onn. Rolling TV Stand for 32""- 70"" TVs","Supports 32""-70"" TVsHolds up to 100 lbs (45.5 kg)Tilts -10/+15 degrees",Electronics Stands,4.4,87.0,onn.,524,524,00681131284639,https://i5.walmartimages.com/asr/9eec018b-33d0-41e4-8ead-2a934b0340d7.72539d23b48db234fe61135e5ced4e33.jpeg?odnHeight=200&odnWidth=200&odnBg=ffffff
2G9HI17SVTQK,7.0,52.99,59.99,HyperX Cloud Stinger S 7.1 Gaming Headset for PC,Virtual 7.1 surround sound via HyperX NGENUITY: Get more immersion and better positional audio with the virtual 7.1 surround sound provided by HyperX NGENUITY software.Immersive in-game,Headsets,4.8,11.0,HyperX,7052,7052,00740617302240,https://i5.walmartimages.com/asr/f3e784e4-d4e5-4297-ab9d-cc437c2c9160.14483f593471067375cb46025b3e76f2.jpeg?odnHeight=200&odnWidth=200&odnBg=ffffff
39DXLUQUDYJB,50.0,99.99,149.99,"SAMSUNG Galaxy Buds+, Cosmic Black (Charging Case Included)","Exactly what you want to hear. Galaxy Buds+ are the perfect fitting earbuds to isolate you from distracting noises, so you can stay focused on what you want. And if youd like to filter in some of the",Headphones,3.7,126.0,SAMSUNG,430,430,00887276413914,https://i5.walmartimages.com/asr/35c9b7ad-a2ca-4ea6-89b9-52dc45ab3aac_1.23ec498a06fe3a427f8489a69b864c98.jpeg?odnHeight=200&odnWidth=200&odnBg=ffffff
7ENV17T2QAZO,50.0,199.0,249.0,"Acer Chromebook 311 CB311-10H-41M9, Military Standard (MIL-STD 810G) impact-resistant body; AMD A-Series Dual-Core A4-9120C, 11.6"" HD, 4GB DDR4, 64GB eMMC, 802.11ac WiFi 5, Bluetooth 4.2, Chrome OS",Merchandise,Laptop Computers,4.1,12.0,Acer,1703,1703,00195133094115,https://i5.walmartimages.com/asr/8e78beb9-9146-4927-b93c-e932dcc1444a.8487ad092cb95e945cd50468ae4d864e.jpeg?odnHeight=200&odnWidth=200&odnBg=ffffff
1D3TWZKPCAXL,30.0,29.99,59.99,"Philips UT102 Wireless In-Ear Headphone, Black",Philips True Wireless UT102 headphones with great audio quality and punchy bassUp to 3 hours of play time + 9 more from the charging caseUltra-compact charging case that slips,Headphones,3.9,62.0,Philips,570,570,00840063200494,https://i5.walmartimages.com/asr/e044fbe7-ce75-4bff-8f4d-37e47a5680b7.508ea0408dd96acc138ac15acced363f.jpeg?odnHeight=200&odnWidth=200&odnBg=ffffff
5PB7SWIJ9YRS,130.0,169.0,299.0,"Core Innovations CLT136401BL 14"" Notebook - Intel Atom Z3850 - 4GB RAM - 64GB SSD - 1920 x 1080 - Windows 10 S - Black","14"" Laptop with Windows 10 SIntel Atom Processor4GB RAM/64 GB Flash Storage",Laptop Computers,3.4,156.0,Core Innovations,2503,2503,00850017290204,https://i5.walmartimages.com/asr/d4c0971b-b76d-4540-b2f7-f02731110e1a.08d2e7de69104dec209ee57bbedee778.jpeg?odnHeight=200&odnWidth=200&odnBg=ffffff
72MMTQCGBIQO,49.12,29.88,79.0,"Simple Mobile LG Journey, 32GB, Black- Prepaid Smartphone","4.45"" HD+ Full Vision Display5MP Front Camera and 8MP Rear Camera3,000 mAh Battery",Cell Phones,4.2,13.0,LG,198,198,00616960333005,https://i5.walmartimages.com/asr/893a96c4-7084-4d31-ae6a-b88c04e425eb_1.e625373cf9f15f3d39a206009e5a2c30.jpeg?odnHeight=200&odnWidth=200&odnBg=ffffff
7FJ2Q9GXXLUQ,70.99,249.0,319.99,"Lenovo Chromebook 3 14""FHD Touchscreen Laptop, Intel Celeron N4020, 4GB RAM, 32GB eMMC HD, Chrome OS, Platinum Gray, 82C10007US",Merchandise,Laptop Computers,4.5,51.0,Lenovo,1393,1393,00194778319829,https://i5.walmartimages.com/asr/b4603cd2-13bd-42b1-b281-758dec778ce4.80c77b6dbddce2e96e0095256a0800ef.jpeg?odnHeight=200&odnWidth=200&odnBg=ffffff
6MAG1CEA2Q74,20.0,79.99,99.99,"TCL Alto 6 32 2.0ch 120W Sound Bar, Black, TS6100-NA","Dolby DigitalStream Music WirelesslyLoud, clear sound in a compact design",Sound Bars,4.0,20.0,TCL,2608,2608,00846042017053,https://i5.walmartimages.com/asr/6981eb44-c54a-44b5-a772-b12e0e067fbf.793f4a1c8a461571c64cbfc1031baa2c.jpeg?odnHeight=200&odnWidth=200&odnBg=ffffff
5U28442GC348,23.49,59.0,82.49,"Seagate STHN2000400 2TB Backup Plus Slim Portable Drive USB 3.0, Black",Seagate Backup Plus Slim STHN2000400 2 TB Hard Drive - External - Portable,Hard Drives,4.5,126.0,Seagate,1182,1182,00763649132357,https://i5.walmartimages.com/asr/76c8e52c-f077-4ef6-a471-f07af3ead459_1.70aabbb984c117c096d00b2bebb9e0ee.jpeg?odnHeight=200&odnWidth=200&odnBg=ffffff
68ZKC66CFHWP,20.11,29.88,49.99,"Walmart Family Mobile LG Rebel 4, 16GB, Black- Prepaid Smartphone","GSM-T5.0"" HD TFT (IPS) Display8MP Rear Camera with Auto Focus5MP Front Camera with Auto Shot",Cell Phones,4.1,165.0,LG,281,281,00616960274056,https://i5.walmartimages.com/asr/24c52c92-464c-4673-8082-de41e75b9c8b_4.1db183005774088575758a216830eda5.jpeg?odnHeight=200&odnWidth=200&odnBg=ffffff
26KXNE3G280A,30.0,149.0,179.0,"AOPEN 24MH2Y Pbipx 23.8-inch Full HD (1920 x 1080) IPS Monitor with AMD FreeSync Premium Technology, Up to 165Hz, 2ms (G to G)","AOPEN's 23.8 inch monitor with Full HD 1080p resolution delivers the incredible. Crisp, true-to-life colors come alive with the amazing 1920 x 1080 resolution, allowing you to enjoy High-Definition",Computer Monitors,0.0,0.0,AOPEN,698,698,00193199921994,https://i5.walmartimages.com/asr/9b0b1d48-c319-46f1-9218-b3a19e820a99.dcd34120d672b978bec19487dc9bafae.jpeg?odnHeight=200&odnWidth=200&odnBg=ffffff
45D0GLTO5TQA,80.0,99.0,179.0,"Total Wireless Samsung Galaxy A11, 32GB Black - Prepaid Smartphone",Total Wireless Tw Samsung A11 S115 Cdma,Cell Phones,3.2,22.0,SAMSUNG,368,368,00616960378785,https://i5.walmartimages.com/asr/976cc1ac-7bdd-4a3e-84ea-f3a6e720d8b3.69e3fc1624f33422f2b792ac27dfd10c.jpeg?odnHeight=200&odnWidth=200&odnBg=ffffff
6NO77UL0BU75,5.4,48.6,54.0,Logitech Comfort Wireless Combo Keyboard and Mouse,Compare with MK550 and MK570Comfort Wireless Combo,Computer Keyboard & Mouse Sets,4.3,369.0,Logitech,684,684,00097855141736,https://i5.walmartimages.com/asr/18aee4b8-2886-4093-8e91-fda21433eb37_1.e3c2c12b602ca06d9a84abc592d03c2e.jpeg?odnHeight=200&odnWidth=200&odnBg=ffffff
5Q8NO8KZ0WX2,166.95,260.0,426.95,NETGEAR - Orbi AC3000 Mesh WiFi System with Router and Satellite Extender (RBK50),"5,000 sq. ft. of WiFi CoverageConnect 25+ devices at onceBuffer-free streaming in every room, compatible with any Modem.",Network Routers,5.0,11640.0,NETGEAR,262,262,00606449116359,https://i5.walmartimages.com/asr/24d77d44-9f88-4858-80eb-623c084fe341_1.1ccd1c7aca653ae06b96a1331cc9ae1e.jpeg?odnHeight=200&odnWidth=200&odnBg=ffffff
4IZ3HY4E7UO5,140.0,159.0,299.0,"Simple Mobile Apple iPhone 7, 32GB, Black- Prepaid Smartphone",Simple Mobile Apple Iphone 7 32gb Black,Cell Phones,2.0,1.0,Apple,117,117,00616960310303,https://i5.walmartimages.com/asr/67e7e817-6bba-4528-b909-0a7eed351ed2_1.b2edffb5acd4adebf60a73434bc69721.jpeg?odnHeight=200&odnWidth=200&odnBg=ffffff
500MCL9WMG78,70.0,229.0,299.0,"Acer 14"" Touchscreen Chromebook, Intel Celeron N4020, 4GB RAM, 32GB HD, Protective Sleeve, Wireless Mouse, Chrome OS, Silver, CB314-1HT-C934",Merchandise,Laptop Computers,4.4,68.0,Acer,1120,1120,00195133026291,https://i5.walmartimages.com/asr/8bc80475-8dbc-4d15-8e39-66a5f18ba60f.fd871f06dd742cdeb91a6fd00c7249ed.jpeg?odnHeight=200&odnWidth=200&odnBg=ffffff
392C28KE2ZE4,20.99,79.0,99.99,Boost Coolpad Brisa,"CoolPad CP3706ASIANB 6.53"" 32GB Storage 3GB RAM Silver LTE Boost Mobile Prepaid CellphoneA spacious 6.53 FHD+ notched display delivers a better and brighter entertainment experience. The vivid colors",Cell Phones,2.6,8.0,Coolpad,89,89,00850005074540,https://i5.walmartimages.com/asr/163a355a-e377-48b8-b530-95e442b3e2e9.3d9cdee20b5efd70caf30c12f567c99f.png?odnHeight=200&odnWidth=200&odnBg=ffffff
4CVSDMHTB6PJ,100.99,99.0,199.99,"VANKYO Burger 101 Wireless Pico Projector, Rechargeable Mini DLPProjector","Wireless&Wired Screen-Sharing,Compatible with WIFI& HDMI enabled devicesDLP Technology Delivers Crystal Clear and High Definition Quality Image40Automatic Keystone Correctionand",Mini Projectors,4.9,36.0,VANKYO,135,135,00810051301489,https://i5.walmartimages.com/asr/3b37c7f7-fb0b-4cc8-8242-f8e6fb4a188a.ebdd7dca4a12913dcd0ae388024a79e2.jpeg?odnHeight=200&odnWidth=200&odnBg=ffffff
22DYB6EVF2C8,100.0,149.0,249.0,"Total Wireless Samsung Galaxy A21, 32GB, Black - Prepaid Smartphone",Merchandise,Cell Phones,4.2,755.0,SAMSUNG,620,620,00616960381761,https://i5.walmartimages.com/asr/5e6e72b0-b68a-4f85-83c9-6056f2a64d12.976f540ea52319d46dd7aaa16178e856.jpeg?odnHeight=200&odnWidth=200&odnBg=ffffff
4FI1S9Z58HSY,70.99,199.0,269.99,ION Audio Party Rocker Max Wireless Rechargeable Bluetooth Speaker with Multi-Effect Party Lights,"Bluetooth Enabled: Stream and control your music wirelesslyHigh-Powered 100-Watt Sound System: 8 (203mm) woofer, 3 (76mm) tweeter deliver lifelike soundMulti-color LED lights",Portable Speakers,4.7,37.0,ION Audio,68,68,00812715018986,https://i5.walmartimages.com/asr/f324334c-4eee-42af-b7df-17dc1104c1aa.c695981c34b17252398ed7654f1cd0db.jpeg?odnHeight=200&odnWidth=200&odnBg=ffffff
7CZVUPF7BGG1,50.0,248.0,298.0,Sony UBP-X800M2 4K Ultra HD Home Theater Streaming Blu-Ray Player with High-Resolution Audio and Wi-Fi Built-In,"See the unrivalled visual clarity of 4K Ultra HD Blu-rayFast, stable built-in Wi-FiDolby Vision and HDR10 for incredible viewing detailHear more detail with",Blu Ray & DVD Players,4.1,188.0,Sony,890,890,00027242913752,https://i5.walmartimages.com/asr/7c1472c5-6c6d-4d87-8755-7aefd1c85102_1.dcbb5d7a6c29acf85e2d7ab5f391b41c.jpeg?odnHeight=200&odnWidth=200&odnBg=ffffff
6ULNMRXUV8JM,40.0,79.0,119.0,Ion Audio Game Day Party Wireless Rechargeable Bluetooth-enabled Speaker System with Lights,"Bluetooth-enabled: Stream and control your music wirelesslyRechargeable Battery: Delivers long-lasting funHigh-Powered 50-Watt Sound System: 6.5"" (165mm) woofer, 2"" (50mm)",Portable Speakers,4.3,72.0,ION Audio,602,602,00842655101943,https://i5.walmartimages.com/asr/095655ad-6e9f-455a-acab-fb8bcbd9c41e.9b91eacec58c9430fd30d86e28296dd0.jpeg?odnHeight=200&odnWidth=200&odnBg=ffffff
2TLSTYTM1091,60.0,329.0,389.0,"HP 14"" Ryzen 3 4GB/128GB - Silver","Windows 10 Home (S mode) with integrated AMD Radeon Graphics AMD Ryzen 3 3250U, Dual-Core, 2.6 GHz up to 3.5 GHz Up to 7.75 hours (video playback), 7.75 hours (wireless streaming) Micro-edge bezel",Laptop Computers,3.9,928.0,HP,525,525,00195697615283,https://i5.walmartimages.com/asr/1e7211d1-6452-48cf-afb0-a3adb1b847f2.8717ef00d5b64c1e54f8da74211d0f3c.jpeg?odnHeight=200&odnWidth=200&odnBg=ffffff
62JE0XWNMOHY,102.0,397.99,499.99,SAMSUNG 5.1ch Soundbar with 3D Surround Sound and Acoustic Beam - HW-Q60T (2020),"Theater experience with DTS Virtual:X 3D surround soundAdvanced acoustic technologies with perfectly balanced, room-filling sound",Sound Bars,4.0,243.0,SAMSUNG,2131,2131,00887276390505,https://i5.walmartimages.com/asr/4335d815-e9a1-4313-801c-5402763fd42d.7a041d55efb67ec0adee2e7a30de83a3.jpeg?odnHeight=200&odnWidth=200&odnBg=ffffff
1AMJB9M7DUVR,40.0,49.0,89.0,"Core Innovations CJR600 150"" LCD Home Theater Projector (Black)","Up to 150"" displayNative resolution: 800x480Versatile connections + supports smartphone mirroring",Multimedia Projectors,4.3,62.0,Core Innovations,5399,5399,00850017290242,https://i5.walmartimages.com/asr/fcf7d840-c12a-4ced-84a9-ded9f5d0b294.5671c5a6584f60df45fe265ac57cc445.jpeg?odnHeight=200&odnWidth=200&odnBg=ffffff
6DWNMKEWB5M1,10.0,39.0,49.0,"TiVo Stream 4K  Every Streaming App and Live TV on One Screen  4K UHD, Dolby Vision HDR and Dolby Atmos Sound  Powered by Android TV  Plug-in Smart TV",Tivo Stream 4k W/ Voice Remote,Streaming Media Players,4.3,149.0,TiVo,4554,4554,00850013114054,https://i5.walmartimages.com/asr/e17fc206-81d2-4a9f-ab61-2dfe0e9a2004.e70fda9a8d7898fff7ff43c8525ff6d0.jpeg?odnHeight=200&odnWidth=200&odnBg=ffffff
