productId,Savings$,Sale_price$,Orig_price$,Item,description,productCategory,customerRating,numReviews,brand,initialQuantity,quantity,standardUpc,imageUrl
1V9Y8DB8U9AH,100.0,499.99,599.99,"TCL 50"" Class 5-Series 4K UHD Dolby Vision HDR QLED Roku Smart TV - 50S535",TCL50S5355-Series 4K OLED Dolby Vision HDR Smart Roku TVPower CordRemote ControlRemote Control BatteryLimited Warranty5-Series 4K OLED Dolby Vision HDR,Televisions,4.3,241.0,TCL,2730,2730,00846042016186,https://i5.walmartimages.com/asr/9c6fa4b8-e715-4688-92d9-a223510a05f1.fe20863340546bd55fd8330b2c8df05d.png?odnHeight=200&odnWidth=200&odnBg=ffffff
2RRKOAAOOFW4,30.0,169.0,199.0,Apple Watch Series 3 GPS - 38mm - Sport Band - Aluminum Case,Elevated in every way.Space Gray aluminum caseIon-X strengthened glassUp to 18 hours of battery lifeGPS/GNSS,Smart Watches,4.6,5079.0,Apple,15366,15366,00190198806116,https://i5.walmartimages.com/asr/83ed7cf5-45b5-4f5e-bbb1-a6dfda21ee30_1.018f1bdadbc903ed087e9a71436a38ac.jpeg?odnHeight=200&odnWidth=200&odnBg=ffffff
3JMS5HDQJKWL,22.0,197.0,219.0,Apple AirPods Pro,"Active Noise Cancellation for immersive soundTransparency mode for hearing and connecting with the world around youThree sizes of soft, tapered silicone tips for a customizable",Headphones,4.6,6172.0,Apple,24765,24765,00190199246850,https://i5.walmartimages.com/asr/c67bebef-646f-4cbb-9f06-432b491540cd_1.a85f65354949e93ab03dcb078a7d6495.jpeg?odnHeight=200&odnWidth=200&odnBg=ffffff
5PAS9XETY60X,50.0,169.0,219.0,"Lenovo 11.6"" Celeron 4GB/32GB Chromebook, 11.6"" HD Display, Intel Celeron N4020 Dual-Core Processor, 4GB Memory, 32GB eMMC Solid State Drive","Display: 11.6""Processor: Intel Celeron N4020 Dual-CoreRAM Memory: 4GBInternal Storage: 32GB eMMCBattery life: 10 hoursOnyx Black",Laptop Computers,4.3,624.0,Lenovo,6731,6731,00194632976403,https://i5.walmartimages.com/asr/2872cadf-7890-4560-859a-ec9afef479ea.7ef6846c343bee70d867efeb66c2efad.jpeg?odnHeight=200&odnWidth=200&odnBg=ffffff
1LYPVR1FMX00,10.88,39.0,49.88,Beats Flex  All-Day Wireless Earphones  Beats Black,Stay connected to the world you love with all-day wireless Beats Flex earphones.,Headphones,4.1,277.0,Beats by Dr. Dre,13195,13195,00190199801561,https://i5.walmartimages.com/asr/eb2eac02-a223-4c6d-ab91-d8c104853e8a.160a20ad2af7cbb1281aba785eb08f52.jpeg?odnHeight=200&odnWidth=200&odnBg=ffffff
74YB6YRZPTS6,80.0,159.0,239.0,"Lenovo 81JW0001US Chromebook S330, 14"" HD Display, Mediatek MT8173C CPU 4GB RAM, 32GB eMMC SSD, Chrome OS, Black",Chrome OSMediaTek MT8173c Quad-core processor4GB Memory32GB EMMc SSD StorageBlack,Laptop Computers,4.1,1041.0,Lenovo,30560,30560,00192940234864,https://i5.walmartimages.com/asr/8a54d8c4-fe2b-45e5-a82d-5e7795cc3bbc_1.b62390d770a96572adaa9584f64bdfe2.jpeg?odnHeight=200&odnWidth=200&odnBg=ffffff
23LC6PQMT7UF,70.99,159.0,229.99,"Samsung CB4 11.6"" Celeron 4GB/32GB Chromebook, 11.6"" HD Display, Intel Celeron Processor N4000, 4GB RAM, 32GB eMMC, Intel UHD Graphics 600 - XE310XBA-K01US (Google Classroom Ready)","Compact, light design with 13.3"" displayMilitary-grade durabilityUltra-fast connectivity with Gigabit WiFiAdvanced security with multiple layers of built-in virus",Laptop Computers,4.2,624.0,SAMSUNG,14145,14145,00887276371399,https://i5.walmartimages.com/asr/b62d59a5-d7c6-4e36-ba8f-774f0cbc5466_9.79edcdbc05fdea8fc2e56824f61a17c8.jpeg?odnHeight=200&odnWidth=200&odnBg=ffffff
6P3V9Y19567B,200.0,299.0,499.0,"Gateway 14.1"" FHD Ultra Slim Notebook, Intel Core i3-1005G1, 4GB RAM, 128GB SSD, Tuned by THX Audio, Fingerprint Scanner, Webcam, HDMI, Cortana, Windows 10 S","Windows 10 Home in S Mode10thGen Intel Core i3-1005G1 Processor (1.2GHz, Up to 3.4GHz, 4M Cache)14.1 LCD IPS Display, (1920 x 1080)",Laptop Computers,4.2,122.0,Gateway,4602,4602,00812550032888,https://i5.walmartimages.com/asr/1a404d25-1196-457f-b3eb-b473eaa710ea.c902149d988ab4ea3da7f7ae959e861d.jpeg?odnHeight=200&odnWidth=200&odnBg=ffffff
76CLI4Q96DNO,80.11,69.88,149.99,Philips HTL1520B Soundbar Speaker with Wireless Subwoofer and HDMI ARC,Philips HTL1520B 2.1 channel soundbar speaker with wireless subwooferWireless subwoofer for an extra oomph and is easy to hide out of sightHDMI ARC input for controlling the,Sound Bars,3.5,20.0,Philips,788,788,00685417541881,https://i5.walmartimages.com/asr/3f206434-d9b2-441d-8d40-1b1592bd8a09.910e08cb30f873f7259aea36749b3cef.jpeg?odnHeight=200&odnWidth=200&odnBg=ffffff
2E8Q3RMEYVTM,80.0,69.99,149.99,"Klipsch Pro Media 2.1 THX Computer Speakers Two-Way Satellites 3"" Midbass Drivers and 6.5"" Subwoofer","200 Watts of Dynamic PowerTHX CertifiedTwo-Way Satellites' 3"" Midbass Drivers6.5"" SubwooferSeparate Primary and Subwoofer Controls",Computer Speakers,4.5,167.0,Klipsch,857,857,00743878038453,https://i5.walmartimages.com/asr/ac0cde14-0cc3-4764-bb9c-1b353a183d11.134ca98b4a9ac60b2833d3cd1a78a362.jpeg?odnHeight=200&odnWidth=200&odnBg=ffffff
4ICHMQNBWLLY,200.0,799.0,999.0,"Lenovo Legion 5 15"" FHD, Intel Core i7-10750H, NVIDIA GeForce GTX 1650, 8GB RAM, 512GB SSD, Phantom Black, Windows 10, 82AU00BTUS",10 Generation Intel Core i7-10750H8GB RAM512GB SSDNVIDIA GeForce GTX 1650Windows 10Phantom Black,Laptop Computers,4.7,1057.0,Lenovo,1491,1491,00195042921885,https://i5.walmartimages.com/asr/152adbdb-9cf7-46fd-b0d0-59014dcd0a44.ea610175003896b8f19e86e3aaad6f2b.jpeg?odnHeight=200&odnWidth=200&odnBg=ffffff
37P6UNKHJQO5,110.0,159.0,269.0,"ASUS C423 14"" Celeron 4GB/64GB Chromebook, 14"" HD Nano-Edge Display, Intel Celeron N3350, 4GB DDR4, 64GB eMMC, Chrome OS, C423NA-WB04 (Google Classroom Ready)","Display: 14"" HD resolution (1366x768)Processor: Intel Celeron N3350 Dual-Core4GB of RAM, 64GB eMMC storageBattery life: 10 hours",Laptop Computers,4.0,391.0,ASUS,5167,5167,00192876266366,https://i5.walmartimages.com/asr/d9d5d780-a1c2-4add-bd93-2de15f58b5ff_10.c2226b4fcd8e430562729d88b60504f9.jpeg?odnHeight=200&odnWidth=200&odnBg=ffffff
3A8Q097PYPWP,100.0,129.0,229.0,"EVOO 11.6"" Ultra Thin Notebook, HD Display, Intel Celeron Processor, 64GB Storage, 4GB Memory, Front Camera, HDMI, Windows 10 S","Windows 10 Home in S mode11.6 HD, 1366 x 768Intel Celeron Processor N4000 (1.10GHz, Up to 2.50GHz)",Laptop Computers,3.6,175.0,EVOO,10061,10061,00812550034028,https://i5.walmartimages.com/asr/79fe6c6b-b6e9-4b6b-89a9-238eb9e729b5.585c800df0da5668a6fe09423c94c1f0.jpeg?odnHeight=200&odnWidth=200&odnBg=ffffff
59CNCY5BVXOG,50.0,199.99,249.99,"TCL 32"" Class 3-Series 720P HD LED Roku Smart TV 32S335","The 3-Series TCL Roku TV puts all your entertainment favorites in one place, allowing seamless access to over 500,000 movies and TV episodes, your cable box, gaming console, and other devices all from",Televisions,4.4,44.0,TCL,106,106,00846042013765,https://i5.walmartimages.com/asr/ba53d911-3fd8-42fb-aeef-f0cb46cd134e.cc48ddd77a60365b1cd2fe99c61f61d4.png?odnHeight=200&odnWidth=200&odnBg=ffffff
7J6YV7YQ73MP,20.0,39.88,59.88,JLab Audio Studio ANC On-Ear Wireless Headphones,"34+ hour Bluetooth battery lifeControl your music with the touch of a button while you hit the beach, travel, or just relax",Headphones,4.3,235.0,JLab Audio,5102,5102,00812887019163,https://i5.walmartimages.com/asr/b5b92dd1-2bf9-4d3a-b3c8-84dbba847727.42d516042b3f97761eb271866ae54b7f.jpeg?odnHeight=200&odnWidth=200&odnBg=ffffff
0Z4AV82LCGBT,50.0,199.0,249.0,"Straight Talk Apple iPhone SE (2020), 64GB","Up to 13 hours of video on a single charge /li>12MP main camera /li>Nationwide coverage on Americas largest and most dependable networksCompatible with talk, text & data",Cell Phones,4.2,798.0,"Straight Talk', 'Apple",140,140,00190199734982,https://i5.walmartimages.com/asr/3c21f5da-5ce1-41f1-bce5-821711c6209b_2.dd8d9aaa2f1ff829e5a2e4f9d268c486.jpeg?odnHeight=200&odnWidth=200&odnBg=ffffff
57HPIV6AS5J7,110.99,199.0,309.99,"Lenovo Chromebook Flex 3 11.6"" Touchscreen Laptop, Intel Celeron, 4GB RAM, 32GB HD, Chrome OS, Almond, 82BB0007US","11.6 HD (1366 x 768) IPS, glossy, touchscreen, 250 nitsIntel Celeron N4020 Processor4 GB LPDDR4 2400MHz (Soldered)32 GB eMMCIntegrated Intel UHD Graphics 600",Laptop Computers,4.6,68.0,Lenovo,18339,18339,00194778319560,https://i5.walmartimages.com/asr/d1021115-1a0d-4098-94b8-b3ee6873908b.6901cd31adb05412b97ae94f4041991c.jpeg?odnHeight=200&odnWidth=200&odnBg=ffffff
53ZMRQPS1APY,10.0,29.0,39.0,"Roku Express 4K+ Streaming Player 4K/HD/HDR with Smooth Wi-Fi, Premium HDMI Cable, Voice Remote | 2021",Roku Merchandise,Streaming Media Players,4.9,238.0,Roku,2958,2958,00829610004747,https://i5.walmartimages.com/asr/21fb1906-8bbd-4e25-91ea-877ebc7b3d1c.cc88946e8fc887ed0c1be236ed04f9e6.png?odnHeight=200&odnWidth=200&odnBg=ffffff
7GPRRVEITAG5,40.0,249.0,289.0,"HP 14"" Pentium 4GB/64GB Chromebook, 14"" HD Display, Intel Pentium Silver N5000, 4GB RAM, 64GB eMMC, Intel UHD Graphics 605, 14a-na0031wm","Chrome with integrated Intel UHD Graphics 600 Intel Celeron N4020 Processor, Dual-Core 1.1 GHz up to 2.8 GHz Up to 12.25 hours mixed usage 360 hinge, Google Assistant, Google Instant Tethering,",Laptop Computers,4.1,418.0,HP,11213,11213,00194721548283,https://i5.walmartimages.com/asr/617aef72-8c6d-407e-98bb-7edd9a53e8dd.12111924582b6560a929a8a10543d557.jpeg?odnHeight=200&odnWidth=200&odnBg=ffffff
1X38ZSQS47RS,99.08,14.99,114.07,Monster MNFLEX BLK Flex Active Noise Canceling Bluetooth Headphones,Active Noise CancellationSports Earbuds8 Hours Battery LifeHandsfree Operation,Headphones,3.8,69.0,Monster,3140,3140,00827396541517,https://i5.walmartimages.com/asr/1ccfd49b-9829-42ca-b417-e1c93e6f46e2_1.fd86c7a8c0836ef3dc10b2884bb336ee.jpeg?odnHeight=200&odnWidth=200&odnBg=ffffff
7140XL89Q7PB,20.0,79.0,99.0,"onn. 8"" Tablet Pro, 32GB Storage, 2GB RAM, Android 10, 2.0 GHz Octa-Core Processor, HD Display","8"" LCD Touchscreen10-hour battery life5 MP front-facing camera & 5 MP rear-facing camera32GB StorageComes with Google Kids Space",Tablet Computers,4.1,310.0,onn.,1348,1348,00681131308717,https://i5.walmartimages.com/asr/2b2b376d-12e0-4291-875e-40e4a28779bd.abae26566772596bd34594592ad39602.jpeg?odnHeight=200&odnWidth=200&odnBg=ffffff
401K4D19VB7C,110.99,429.0,539.99,"Lenovo Ideapad Flex 5 14"" FHD Touchscreen Laptop, Intel Core i3, 4GB RAM, 128GB SSD, Windows 10, Gray, 82HS007CUS","3.0 GHz Intel Core i3-1115G4 Dual-Core4GB DDR4 RAM | 128GB M.2 NVMe SSD14.0"" 1920 x 1080 IPS",Laptop Computers,4.6,128.0,Lenovo,3219,3219,00195477202115,https://i5.walmartimages.com/asr/562bf0ab-10bc-4899-b1e0-ddbe3936e751.b8ac54f06a06c07258c2bc1bdead16f3.jpeg?odnHeight=200&odnWidth=200&odnBg=ffffff
6SJVHBHRODL1,6.0,29.0,35.0,"Roku Express 4K Streaming Player 4K/HD/HDR with Smooth Wi-Fi, Premium HDMI Cable | 2021","Brilliant 4K picture quality: Stream in HD, 4K, and HDR with sharp resolution and vivid color optimized for your TVSmooth wireless streaming: Enjoy a smooth streaming experience with",Streaming Media Players,4.9,28.0,Roku,2555,2555,00829610004839,https://i5.walmartimages.com/asr/b3f580fc-31ef-4d64-8015-e4d2b253d2a6.92dd4cc29bc11fb14d534b42b1ad5ab2.png?odnHeight=200&odnWidth=200&odnBg=ffffff
18N7VA8X70R6,30.0,99.0,129.0,"Belkin Dual Band AX3200 Wifi 6 Router, 3.2 Gbps, White (RT3200)","Dual band AX3200 wireless networking to handle 25+ devicesEnhanced WiFi speeds up to 3.2 GbpsCovers up to 2,000 sq ftWPA3 security, guest access, and parental controls",Network Routers,4.3,176.0,Belkin,7238,7238,00745883809653,https://i5.walmartimages.com/asr/65428d85-c485-4d29-90b5-0756683b6808.fbacee37643ff75ae80433ee81020f93.jpeg?odnHeight=200&odnWidth=200&odnBg=ffffff
125NU0TJLEB8,503.0,1496.99,1999.99,"LG 55"" Class 4K UHD Smart OLED C1 Series TV with AI ThinQ OLED55C1PUB",What makes OLED unlike anything else?The answer is self-lit pixels. A self-luminous display technology that makes all the difference to your viewing experience. Unlike LED TVs that are restricted by,Televisions,4.8,111.0,LG,560,560,00195174006016,https://i5.walmartimages.com/asr/89423986-7678-471d-9b08-f7aa4569f6f3.27b8f54d62fc40f47b5e6b1cea4f4d1a.jpeg?odnHeight=200&odnWidth=200&odnBg=ffffff
1BPKC0WN2UQC,100.0,129.0,229.0,"Acer Chromebook 311, 11.6"" HD, Intel Celeron N4020, 4GB LPDDR4, 32GB eMMC, Pure Silver, Gigabit WiFi, Bluetooth 5.0, CB311-9H-C4XC","Companion On-the-Go. Powered by an Intel Celeron processor, the Chromebook loads content-rich webpages fast, provide crisp video playback, and enable you to multitask effortlessly by allowing",Laptop Computers,4.4,197.0,Acer,6025,6025,00195133087339,https://i5.walmartimages.com/asr/d25a585d-cd81-44fc-97fe-8074c112f2ef.fb82102c15d0cb95944b91b672434050.png?odnHeight=200&odnWidth=200&odnBg=ffffff
36NUS3X7N42C,150.0,244.0,394.0,"Straight Talk Apple iPhone XR, 64GB, Coral - Prepaid Smartphone + ST $45 UNLIMITED",12MP Wide cameraDigital zoom up to 5x6.1 all-screen LCD Multi-Touch displayNationwide coverage on Americas largest and most dependable networks*Compatible with,Cell Phones,5.0,4.0,Straight Talk,1867,1867,00616960433675,https://i5.walmartimages.com/asr/08de3c79-ba9a-4894-bdaf-2148fcf15936.bbd9874bc76db907f4386034af1784ac.jpeg?odnHeight=200&odnWidth=200&odnBg=ffffff
4FWIK2C1F6V7,10.0,39.0,49.0,Roku Streaming Stick+ HD/4K/HDR Streaming Device with Long-range Wireless and Voice Remote with TV Controls,Roku Streaming Stick Plus 1080 4k Hdr,Streaming Media Players,4.6,6613.0,Roku,2609,2609,00829610001975,https://i5.walmartimages.com/asr/c650f4b6-5284-44c1-9285-59ee90f7316c.930766aa904645029bbc5066fa1f6d7e.png?odnHeight=200&odnWidth=200&odnBg=ffffff
2JELKOWNKS29,15.03,24.96,39.99,"Ematic Full-Motion Articulating, Tilt/Swivel, Universal Wall Mount for 17""- 55"" TVs with 6-Foot HDMI Cable","Designed for LCD monitors and displays up to 55"" and 88 lbsMade from high-quality aluminum alloy for added strength and durability6-foot HDMI cable included",TV & Monitor Mounts,4.4,1502.0,Ematic,10298,10298,00817707017961,https://i5.walmartimages.com/asr/ef6da806-03ac-41e8-a834-4fae8e0891ac_1.897cfd18f6368ca65936bcc04cf87c03.jpeg?odnHeight=200&odnWidth=200&odnBg=ffffff
6IW6MXZ0SPSX,30.99,189.0,219.99,"Acer CB272U smiiprx 27"" WQHD (2560 x 1440) IPS Frameless, AMD FreeSync, 100% sRGB, ErgoStand Monitor (Display Port, 2 x HDMI 2.0 ports) Monitor","Enjoy an outstanding visual experience with a CB2 Series ZeroFrame monitor, designed with prosumers in mind.",Computer Monitors,0.0,0.0,Acer,2106,2106,00193199822727,https://i5.walmartimages.com/asr/3d79150d-3967-49a6-909a-daf8cc1ed253.04f952188b4eb4e6bae69e9f401aa5ca.jpeg?odnHeight=200&odnWidth=200&odnBg=ffffff
4UTUVENH62XI,130.01,169.98,299.99,Contixo F30 4K UHD Drone for Adults with Wifi Camera GPS FPV Follow Me Two Batteries,4K UHD Camera & WIFIBrushless MotorDraw a PathGPS Follow Me ModeOptical Flow & Altitude Hold,Aerial Drones,5.0,1823.0,Contixo,442,442,00731642718267,https://i5.walmartimages.com/asr/f4be8899-c58e-4df0-82ba-3c3d0754fafe.a730916f9f22e1669cad198dd138c81b.jpeg?odnHeight=200&odnWidth=200&odnBg=ffffff
6L9DL6JEGAHS,603.0,2096.99,2699.99,"LG 65"" Class 4K UHD Smart OLED C1 Series TV with AI ThinQ OLED65C1PUB","We aim to show you accurate product information.Manufacturers, suppliers and others provide what you see here, and we have not verified it.See our disclaimer",Televisions,4.8,109.0,LG,311,311,00195174006047,https://i5.walmartimages.com/asr/89423986-7678-471d-9b08-f7aa4569f6f3.27b8f54d62fc40f47b5e6b1cea4f4d1a.jpeg?odnHeight=200&odnWidth=200&odnBg=ffffff
773PQKJ0WEW9,80.99,99.0,179.99,"Straight Talk Samsung Galaxy A11, 32GB, Black - Prepaid Smartphone",Straight Talk St Samsung A11 S115 Cdma,Cell Phones,3.6,120.0,SAMSUNG,1222,1222,00616960378730,https://i5.walmartimages.com/asr/976cc1ac-7bdd-4a3e-84ea-f3a6e720d8b3.69e3fc1624f33422f2b792ac27dfd10c.jpeg?odnHeight=200&odnWidth=200&odnBg=ffffff
6OVC72F7R5QF,26.99,173.0,199.99,"TCL 32"" Class 720P HD LED Roku Smart TV 3 Series 32S331","TCL 32"" Class HD (720P) Roku Smart LED TV (32S331):


High definition (720p) resolution
TCL 32"" smart TV has a simple, intuitive Roku interface
Stream over 500,000 movies and TV",Televisions,4.3,2249.0,TCL,4737,4737,00846042013543,https://i5.walmartimages.com/asr/fe7464f9-9701-41c5-86d8-09ee4738cf00_1.da520b520a0c87f5249a1bf74e3ab2df.jpeg?odnHeight=200&odnWidth=200&odnBg=ffffff
33ZNCF7OAAJ6,30.0,119.0,149.0,Ion Audio Party Boom FX High-Power Bluetooth-enabled Rechargeable Speaker with Lights,"100-watt peak power amplifier with Bass Boost button8-inch woofer and 3-inch tweeter deliver clear, lifelike soundWoofer glows in colors full spectrumMultiple color",Portable Speakers,4.8,62.0,ION Audio,200,200,00842655102339,https://i5.walmartimages.com/asr/79f60cdf-b814-4232-b5eb-26daae9517b2.dae15faf8c86182dd13b31fc63176a12.jpeg?odnHeight=200&odnWidth=200&odnBg=ffffff
72344FC4627A,150.0,149.0,299.0,"Philips HTL3320 3.1 Channel Dolby Audio Soundbar with Wireless Subwoofer, HDMI ARC and Bluetooth Streaming","HDMI-out (ARC). Control the soundbar with your TV remote3 channels: midrange drivers, and tweeters. Central speaker for sparkling dialogue.Wireless sub-woofer. Deeper bass. Dolby",Sound Bars,4.3,50.0,Philips,1883,1883,00840063200173,https://i5.walmartimages.com/asr/49dcc5d4-b756-49d4-ae04-dbcaacff5a46.b90e680a98c643f90fd3a03bda8e6697.jpeg?odnHeight=200&odnWidth=200&odnBg=ffffff
6ZEZ74QDQ405,70.01,79.98,149.99,TP-Link  Archer C2300 | Dual Band MU-MIMO Gigabit Wi-Fi Router | up to 2.3 Gbps Speed,High speed up to 2300 MbpsMU-MIMO connects more WiFi devices at once for faster performanceRangeBoost for Far-Reaching WiFi,Network Routers,4.4,108.0,TP-Link,733,733,00845973080754,https://i5.walmartimages.com/asr/94b0ac0a-b90b-44dc-b21a-9aa5213147a7_1.1d1cde06dd67cc2d7754a55b4b9ac99a.png?odnHeight=200&odnWidth=200&odnBg=ffffff
19AO8NXF70LA,20.0,79.0,99.0,Ion Audio Pro Glow 8 Compact High-Powered PA System with Lights,"Bluetooth-enabled: Stream and control your music wirelesslyBi-amplified 150-Watt Sound System: 8"" (203mm) woofer, 1"" (25.4mm) tweeter deliver lifelike soundMulti-colored Lights:",Portable Speakers,4.6,33.0,ION Audio,200,200,00842655100144,https://i5.walmartimages.com/asr/0a9953da-2c5f-4882-8b92-c1c255a4992e.d521bdc68bd8c8f833dde277138d89de.jpeg?odnHeight=200&odnWidth=200&odnBg=ffffff
47FG5RLZAG48,320.0,429.0,749.0,"Gateway 15.6"" FHD Ultra Slim Notebook, Intel Core i5-1035G1, 16GB RAM, 256GB SSD, Webcam, HDMI, Fingerprint Scanner, Cortana, Windows 10 Home","Windows 10 Home10thGen Intel Core i5-1035G1 Processor (1.0GHz, Up to 3.6GHz, 6M Cache)15.6 LCD IPS Display, (1920 x 1080)",Laptop Computers,4.0,362.0,Gateway,5532,5532,00812550032970,https://i5.walmartimages.com/asr/d4363192-ff9f-45e2-9d17-d72f14429b8e.1073d4c643de7b72ff7341b99a4f37e2.jpeg?odnHeight=200&odnWidth=200&odnBg=ffffff
4MBDOEFNMK14,40.0,49.0,89.0,"Core Innovations CJR600 150"" LCD Home Theater Projector (White)","Up to 150"" displayNative resolution: 800x480Versatile connections + supports smartphone mirroring",Multimedia Projectors,4.2,66.0,Core Innovations,2942,2942,00850017290259,https://i5.walmartimages.com/asr/7c76aaac-5341-4df6-8cea-9918bd2262e1.d76ca686bfbfbf4a19cc04d2d5525f68.jpeg?odnHeight=200&odnWidth=200&odnBg=ffffff
4D5FLGF3LNX4,150.0,249.0,399.0,"Straight Talk Samsung Galaxy A51, 128GB, Prism Crush Black - Prepaid Smartphone","Straight Talk Samsung Galaxy A51, 128GB Prism Crush Black - Prepaid SmartphoneCDMA48MP main camera12MP Ultra Wide camera32MP front selfie camera6.5"" Infinity-O",Cell Phones,4.2,1065.0,SAMSUNG,2108,2108,00616960374626,https://i5.walmartimages.com/asr/4f83df0d-f483-432a-8299-8578b3ea22dd.d5c08c4ae76ea37b43e64f12b7b51659.jpeg?odnHeight=200&odnWidth=200&odnBg=ffffff
21C0QWCYGG9L,25.04,24.95,49.99,"Contixo Kid Safe 85dB On Ear Foldable Wireless Bluetooth Headphone w/ Volume Limiter, Built-in Micro Phone, Micro SD card Music Player, FM Stereo Radio, Audio Input & Output (Pink)",10 Hours of Full ChargeBuilt-in Microphone30 Ft of RangeNoise Canceling85db for Childrens Hearing,Headphones,4.9,2478.0,Contixo,975,975,00731642723476,https://i5.walmartimages.com/asr/1e7e4240-002b-442f-a1c1-b8eb7484277c_1.890a7d89380ba60258582b2c036e954b.jpeg?odnHeight=200&odnWidth=200&odnBg=ffffff
3QA7SCOX4BIW,2.97,14.99,17.96,"Onn Full-Motion Wall Mount for 10""- 50"" TVs with Tilt and Swivel Articulating Arm type with free HDMI Cable (UL Certified) ONA16TMO11E","Fits 10"" to 50"" flat-panel TVsIncludes Bonus 6' HDMI 2.0 CableVESA Mounting Standard holes: 75mm x 75mm, 100mm x 100mm, 100mm x 200mm, 200mm x 200mmWeight:2.5 lbs",TV & Monitor Mounts,4.4,9189.0,onn.,28756,28756,00681131134453,https://i5.walmartimages.com/asr/575ad982-f967-4703-805d-ae947e461a66_1.ca8ed41d86c66e762f462f99b93ba1f1.jpeg?odnHeight=200&odnWidth=200&odnBg=ffffff
4P8ZQY0CS9SH,20.0,49.0,69.0,"AT&T Alcatel Axel, 32GB, Graphic Metallic Wave - Prepaid Smartphone","AT&T PREPAID Alcatel Axel 32GB Prepaid Smartphone, Prism",Cell Phones,3.1,13.0,Alcatel,91,91,00889063511018,https://i5.walmartimages.com/asr/4db40470-aa31-4907-9f30-7ff73a1e069f.fce6449ff7af5a0e4901531df8393823.png?odnHeight=200&odnWidth=200&odnBg=ffffff
14ELQQ63MYSS,80.0,189.0,269.0,Google Nest Wifi 2 Pack (AC2200 Mesh Router with 1 Point),,Network Routers,3.9,263.0,"Google Nest', 'Google",968,968,00193575001609,https://i5.walmartimages.com/asr/18b57c86-0fd8-4034-8053-6a2c07375775_1.d42f4fb88277d6027b8f34f0f4491f65.png?odnHeight=200&odnWidth=200&odnBg=ffffff
35KLG8ODW86S,9.91,29.97,39.88,NETGEAR - R6020 AC750 Smart WiFi Router,"1,500 sq. ft. of WiFi CoverageConnect 15+ devices at once750Mbps WiFi speeds for streaming and video calls",Network Routers,4.7,1484.0,NETGEAR,647,647,00606449119923,https://i5.walmartimages.com/asr/b73e1542-4e3a-4d4e-bc43-c107fb1fc4c8_1.0e61d2e2235818d27264258a5e8ee663.png?odnHeight=200&odnWidth=200&odnBg=ffffff
63FRH65SBC4G,60.0,289.0,349.0,Google Nest Wifi 3 Pack (AC2200 Mesh Router with 2 Points),,Network Routers,3.9,274.0,Google,838,838,00193575001616,https://i5.walmartimages.com/asr/e0d8ccde-62e2-4750-8a47-f3dba03b4689_4.ae853184f004dbe1be089c6685e9f640.jpeg?odnHeight=200&odnWidth=200&odnBg=ffffff
7J59J9PMWMG6,150.0,238.88,388.88,"Walmart Family Mobile Apple iPhone XR, 64GB, Coral - Prepaid Smartphone + WFM $39.88 UNLIMITED","12MP Wide cameraDigital zoom up to 5x6.1 all-screen LCD Multi-Touch displayNon-stop nationwide coverage powered by T-Mobile*Compatible with talk, text & data",Cell Phones,0.0,0.0,Apple,347,347,00616960433682,https://i5.walmartimages.com/asr/6966787e-89c5-44b4-9b24-8c9693da2126.33ce3b1bd40bd3626c97920016217536.jpeg?odnHeight=200&odnWidth=200&odnBg=ffffff
6G0VTXGL8B06,20.0,59.0,79.0,"Roku Ultra LT | HD/4K/HDR Streaming Media Player with Ethernet Port and Roku Voice Remote with Headphone Jack, includes Headphones","Roku Ultra Lt, 4662rw",Streaming Media Players,4.5,938.0,Roku,6021,6021,00829610003542,https://i5.walmartimages.com/asr/717db455-34bf-48f4-b82f-fc2e9589586d.c273d1d962fcafaee3dd0414ba27ceb5.png?odnHeight=200&odnWidth=200&odnBg=ffffff
399ISIDPEU1I,50.99,179.0,229.99,SAMSUNG 240W 4.1ch Soundbar with Wireless Rear Kit - HW-T47M (2020),Wireless Rear Speakers includedWireless SubwooferBluetooth TV connectionSurround Sound ExpansionSamsung One Remote,Sound Bars,3.7,53.0,SAMSUNG,76,76,00887276390451,https://i5.walmartimages.com/asr/0d74cfba-a885-4fb4-9e4d-2a1c26280f93.bcd5861feb66caee80a631b393768c7f.jpeg?odnHeight=200&odnWidth=200&odnBg=ffffff
2HBHG5SXJVDV,202.0,1297.99,1499.99,"SAMSUNG 55"" Class 4K Ultra HD (2160P) HDR Smart The Serif QLED TV QN55LS01 2020","SAMQN55LS01TASamsung The Serif LS01T 55"" Class HDR 4K UHD Smart QLED TVRemote Control with BatteryPower CableLimited 1-Year WarrantyUnconditionally",Televisions,4.7,128.0,SAMSUNG,23,23,00887276405605,https://i5.walmartimages.com/asr/b7445558-1b14-461c-9ed0-514a14b1fe15.025f535553beb2c911b64c7314ce0c2e.jpeg?odnHeight=200&odnWidth=200&odnBg=ffffff
6QOWPM7FKS03,20.0,109.0,129.0,"VANKYO Leisure 470 Mini Wifi Projector, 250'' Large Screen and 1080P Supported LCD Home Theater Projector",WiFi Synchronize Smartphone ScreenCompatible with iOS and Android System250' Large Screen Home Theater ProjectorMini Portable Projector for Indoor and Outdoor,Video Projectors,4.7,59.0,VANKYO,712,712,00810051301472,https://i5.walmartimages.com/asr/37ab94bb-de3d-42da-8ac2-71002668d3aa.3d599874511e4d6966073c7388ee5f3a.jpeg?odnHeight=200&odnWidth=200&odnBg=ffffff
3T2YEVBXG4CM,100.0,249.0,349.0,"Cricket Wireless Apple iPhone SE20, 64 GB, White - Prepaid Smartphone",Apple Cricket Iphone Se2 White,Cell Phones,4.4,361.0,Apple,147,147,00190199735019,https://i5.walmartimages.com/asr/e72ffd81-c626-48ab-810e-cbb27c30d030_2.0d4e6e5dbd6bc1e39b0a3d0b8ecb4553.jpeg?odnHeight=200&odnWidth=200&odnBg=ffffff
6F67BI9A5OFB,70.99,449.0,519.99,"Lenovo Ideapad 3 15.6"" FHD PC Laptop, AMD Ryzen 5, 8GB RAM, 256GB SSD, Windows 10 Home, Abyss Blue, 82KU003NUS",2.1 GHz AMD Ryzen 5 5500U Six-Core8GB DDR4 RAM256GB NVMe TLC SSDWindows 10,Laptop Computers,4.6,216.0,Lenovo,9288,9288,00195477775268,https://i5.walmartimages.com/asr/326a761a-2ab3-4d5f-84e5-f4f9dbc16b86.b7531a699db6ad32d36473c15e8d44e9.jpeg?odnHeight=200&odnWidth=200&odnBg=ffffff
5FIKGQYS7ZTL,270.0,429.0,699.0,"Gateway 14.1"" FHD Ultra Slim Notebook, Intel Core i5-1035G1, 16GB RAM, 256GB SSD, Tuned by THX Audio, Fingerprint Scanner, Webcam, HDMI, Cortana, Windows 10 Home","Windows 10 Home10thGen Intel Core i5-1035G1 Processor (1.0GHz, Up to 3.6GHz, 6M Cache)14.1 LCD IPS Display, (1920 x 1080)",Laptop Computers,3.8,301.0,Gateway,1826,1826,00812550032949,https://i5.walmartimages.com/asr/2ac22d6f-f18a-485b-96a3-f07d002d3865.d467856c3693f0a86e5e682edb4728f2.jpeg?odnHeight=200&odnWidth=200&odnBg=ffffff
40OSKUPVKCP2,501.96,1197.99,1699.95,"SAMSUNG 50"" Class 4K (2160P) The Frame QLED Smart TV QN50LS03 2021","Art Mode The Frame transforms into a beautiful work of art when you're not watching TVArt Store Buy individual pieces or subscribe to a library with over 1,400 artists' work100%",Televisions,4.6,260.0,SAMSUNG,653,653,00887276522579,https://i5.walmartimages.com/asr/cdfd2d1c-9977-4dbd-9a2f-0b6d7a6725f5.77aa2ff621514494ed687b396ae9a44c.jpeg?odnHeight=200&odnWidth=200&odnBg=ffffff
