productId,Savings$,Sale_price$,Orig_price$,Item,description,productCategory,customerRating,numReviews,brand,initialQuantity,quantity,standardUpc,imageUrl
58IP4VX0HG86,15.01,14.98,29.99,"Contixo Kids Headphones Soft Fleece Headband Volume Limited with Ultra-Thin Speakers Toddler Children's Earphones for Home, School & Travel, H1-Panda","SOFT, WARM, COZY FLEECE KIDS HEADPHONES/EARPHONES/EARBUDS - Designed with kids in mind, our Contixo H1 soft fleece kids headphones are fun for kids of all ages (note - headphones fit up to 19 inches",Headphones,5.0,1464.0,Contixo,529,529,00850001962070,https://i5.walmartimages.com/asr/a478f981-049a-40ea-aee5-477a8590e076.e4643c583617706f2117c2834e3a375f.jpeg?odnHeight=200&odnWidth=200&odnBg=ffffff
5EBPR9NSA5EV,20.0,128.0,148.0,"VIZIO 36"" 2.1 Sound Bar System - Black (SB3621n-H8)","Performance 3 total speakers create louder, clearer, and more powerful sound.Wireless Subwoofer Experience deep, booming bass with the wireless subwoofer.DTS Virtual:X sound",Sound Bars,4.6,140.0,VIZIO,822,822,00845226018770,https://i5.walmartimages.com/asr/53d990ce-345e-4351-8d6a-614548ab7569.097afdff6489a22a27839210d6f7a488.png?odnHeight=200&odnWidth=200&odnBg=ffffff
3X7X42RU2XKM,40.0,29.99,69.99,"Contixo Premium Child Safe Headphones for Kids With Volume Limit Controls (Max 85dB), Bluetooth Wireless Headphones Over-The-Ear With Comfortable Cushioning (White)",85db for Children's Hearing20 Hours of Battery LifeBlock Background NoiseWireless Bluetooth Connection3.5mm Cable included,Headphones,5.0,2.0,Contixo,1028,1028,00731642721090,https://i5.walmartimages.com/asr/5f788dd2-1ddd-4a62-ab8c-a874e28fff3e_1.92f96559060b739933498d1920165bca.jpeg?odnHeight=200&odnWidth=200&odnBg=ffffff
6MQW0W0BRL5T,80.99,169.0,249.99,SanDisk 1TB Extreme Portable External SSD - SDSSDE61-1T00-G25,"Your lifes an adventure. To capture and keep its best moments, you need fast, high-capacity storage that accelerates every move. 1050MB/s read and 1000MB/s write speeds let you store your content and",Hard Drives,5.0,3.0,SanDisk,626,626,00619659182557,https://i5.walmartimages.com/asr/7b058988-b5b4-42a7-8780-4d14e157a33c.4f790f09a896b17d9547f2ce0ea0f51e.jpeg?odnHeight=200&odnWidth=200&odnBg=ffffff
6ZB2R2OGI4GX,6.0,6.99,12.99,Centon MP Essential USB 3.0 Datastick Pro (Black),Centon 32GB MP Essential USB 3.0 Datastick Pro Flash Drive,Flash Drives,4.1,28.0,Centon,795,795,00731969518137,https://i5.walmartimages.com/asr/d8936f03-3718-4c20-bdbb-ea469c829237_1.111d75c0a0b975734b6f2d3e89b9c3c5.jpeg?odnHeight=200&odnWidth=200&odnBg=ffffff
2I7PGGFIZHR6,50.99,249.0,299.99,TCL Alto 9+ 3.1ch 540W Dolby Atmos Sound Bar with Wireless Subwoofer  TS9030-NA,"RAYDANZ technology for an ultra-wide soundstage.Roku TV ReadyTMfor quick, hassle-free setup and useWireless subwoofer for pulse-pounding bass",Sound Bars,3.8,6.0,TCL,993,993,00846042016322,https://i5.walmartimages.com/asr/b5c60146-431a-435b-b7c7-8128a704025a.804fd863705afd07a78a23b4f4582767.png?odnHeight=200&odnWidth=200&odnBg=ffffff
4ELVKIGZ3KS1,657.47,1314.95,1972.42,Apple iPad Pro 12.9 (2021) Wifi,Apple 12.9-inch iPad Pro (2021) Wi-Fi 128GB - Space Gray,Tablet Computers,4.7,27.0,Apple,1,1,00194252194805,https://i5.walmartimages.com/asr/fc75a562-c0c2-468b-9e74-3e49d9aa1b85.ba1872fcf55df8fcb81e8e4a7788a3ef.jpeg?odnHeight=200&odnWidth=200&odnBg=ffffff
1Y0OAN8GQ6W5,27.0,22.99,49.99,"Contixo KB-100 Wireless Kids Headphones, Volume Safe Limit 85db, On-The-Ear Bluetooth Headphones, Kids Adjustable Headset (Black)",85db for Children's Hearing20 Hours of Battery LifeBlock Background NoiseWireless Bluetooth Connection3.5mm Cable included,Headphones,4.9,841.0,"Contixo', 'Epic International",30,30,00731642722448,https://i5.walmartimages.com/asr/1699d6b3-8f5e-49b3-91a3-d852901eab8a.f93301512c94f037b38842cbeed90302.jpeg?odnHeight=200&odnWidth=200&odnBg=ffffff
4JAO29Y3D5YA,50.0,219.0,269.0,"Acer Chromebook 314, Intel Celeron N4020, 14"" HD Display, 4GB LPDDR4, 32GB eMMC, Intel 802.11ac Gigabit WiFi 5, Protective Sleeve, Wireless Mouse, Chrome OS, CB314-1H-C7W8","Intel Celeron N4020 Dual-Core Processor (Up to 2.8GHz)14"" HD (1366 x 768) Widescreen ComfyView LED-backlit DisplayIntel UHD Graphics 6004GB of Onboard LPDDR4 Memory and",Laptop Computers,4.5,64.0,Acer,1212,1212,00195133026284,https://i5.walmartimages.com/asr/cb3724b5-2bf5-40e6-9d96-cab2d4334c7e.1d320229f413d67f24f780b5c4c32d59.jpeg?odnHeight=200&odnWidth=200&odnBg=ffffff
5YUB8D7C50ZT,50.0,149.99,199.99,"TCL Alto 8i 2.1ch 260W Dolby Atmos Sound bar with Dual Built-in Subwoofers, Black, TS8111",The Alto 8i lets you add immersive theater-quality surround sound with a single slim sound bar.Dolby Atmos technology brings multi-dimensional sound for greater depth and excitement so you're able to,Sound Bars,4.7,38.0,TCL,971,971,00846042017039,https://i5.walmartimages.com/asr/bdbcfec0-d28c-48de-8ae0-7831d4a55b36.fa0c01f28f065c1a12f4105b280c89a6.jpeg?odnHeight=200&odnWidth=200&odnBg=ffffff
3C2PUCNADBZC,30.0,99.0,129.0,TP-Link Archer AX3000 | 4 Stream Dual-Band WiFi 6 Wireless Router | up to 3 Gbps Speeds | Powered by Dual Core Processor,"The Archer AX3000 4-stream dual-band router reaches speeds of up to 3 Gbps, for a buffer-free online Experience. Great for online work or school meetings. Don't pay $10/month to Rent.",Network Routers,4.3,465.0,TP-Link,1541,1541,00845973088781,https://i5.walmartimages.com/asr/d932642a-f3eb-4c53-be26-6a8d66bf5404_1.126141ecb49686209638e33e1b44d006.png?odnHeight=200&odnWidth=200&odnBg=ffffff
5NNWHE38XY81,20.0,79.0,99.0,TP-Link Archer AX1800 | 4 Stream Dual-Band WiFi 6 Wireless Router | up to 1.8 Gbps Speeds | 1.5 GHz Quad-Core CPU,"Works with any internet service provider, the Archer AX1800 Wi-Fi 6 router lets you connect more devices with faster speeds while reducing lag",Network Routers,4.4,187.0,TP-Link,1337,1337,00840030701139,https://i5.walmartimages.com/asr/ebc42edd-f3c5-4b80-9e1c-4c207e6c5f70.1aaedea3ff8ad908f9f7aa3fefa883ec.jpeg?odnHeight=200&odnWidth=200&odnBg=ffffff
5A729SOLEVUP,40.0,229.0,269.0,"ASUS Chromebook C523 Laptop - 15.6"" HD NanoEdge Display with 180 Degree Hinge, Intel Dual Core Celeron N3350 Processor, 4GB RAM, 32GB eMMC Storage, Chrome OS, C523NA-DH02","Asus C523NA-DH02 15.6"" Chromebook Laptop Celeron N3350 4GB 32GB eMMC Chrome OS",Laptop Computers,4.2,41.0,ASUS,2038,2038,00192876099223,https://i5.walmartimages.com/asr/ba8ecdb7-3bab-4f02-8bdf-549614f23979.01dcca8a30f8b77227feb76ff932ab9d.jpeg?odnHeight=200&odnWidth=200&odnBg=ffffff
5WFS4FK4LDNQ,170.99,1329.0,1499.99,"Apple 13.3"" MacBook Pro Touch Bar 1.4GHz quad-core 8th-gen Intel i5, 512GB, 8GB",Intel Iris Plus Graphics 645Touch Bar and Touch IDEighth-generation quad-core Intel Core i5 processorBacklit Magic KeyboardBrilliant Retina display with True,Laptop Computers,0.0,0.0,Apple,8,8,00190199523005,https://i5.walmartimages.com/asr/6a2ef768-d698-4381-8371-146fe2291a64.f61be15e7e4ef2ab3ec2113d580c7dfe.jpeg?odnHeight=200&odnWidth=200&odnBg=ffffff
1RR7N8GETK83,60.11,39.88,99.99,Philips HTL1508 Soundbar Speaker with Bluetooth Streaming,PHILIPS HTL1508 SOUNDBAR SPEAKER 30W,Sound Bars,3.4,30.0,Philips,467,467,00840063200807,https://i5.walmartimages.com/asr/5c10d388-4428-4f8a-993b-3e3da1f4c1e9.d6574db39308d8b91f77e6e5a224a9f8.jpeg?odnHeight=200&odnWidth=200&odnBg=ffffff
3RUWL8O5VHPK,50.0,49.99,99.99,Contixo B3 Wireless Bluetooth Earbuds In-Ear Earphones Handsfree With Noise Canceling Active Sports Neckband,"Noise CancellationDiginex Earbuds ControllerLightweight, Durable and ComfortableClear Crisp Call QualitySweat Proof",Headsets,4.6,10.0,Contixo,89,89,00731642719912,https://i5.walmartimages.com/asr/2472ea19-1f93-4328-aab0-5d7b8c4a47f4.702c43b0d067b4ba7658c78cd7c0b3e8.jpeg?odnHeight=200&odnWidth=200&odnBg=ffffff
1ZXQVI2ROERL,50.99,199.0,249.99,"Panasonic DP-UB420-K 4K Ultra HD Blu-ray Player with HDR10, HDR10+ and Hybrid Log-Gamma (HLG) Playback Plus Smart Voice Control",Ultra HD Blu-ray Playback (4K/HDR): Supreme Picture Quality with the New HCX Processor,Blu Ray & DVD Players,5.0,2.0,Panasonic,230,230,00885170334373,https://i5.walmartimages.com/asr/594e97f0-e97c-48f8-bc18-25d4ebcdf9a1.b06ac85fc790ab10dadece08311e0d1e.jpeg?odnHeight=200&odnWidth=200&odnBg=ffffff
5FX0J2CF5E92,10.0,69.0,79.0,TP-Link Archer AX1500 WiFi 6 Dual-Band Wireless Router | up to 1.5 Gbps Speeds | 1.5 GHz Tri-Core CPU,Works with any internet provider. The Archer AX1500 reaches speeds of up to 1.5 Gbps for a buffer-free 4K/HD streaming and gaming experience.,Network Routers,4.4,457.0,TP-Link,562,562,00840030700323,https://i5.walmartimages.com/asr/c25348d0-2c2c-4efb-a633-6886e2d09b06_1.9a75530eaac204d87278fb6fabf6d12e.png?odnHeight=200&odnWidth=200&odnBg=ffffff
5CPLJJH0RYE1,200.0,299.0,499.0,"Gateway 14.1"" FHD Ultra Slim Notebook, AMD Ryzen 3 3200U, 4GB RAM, 128GB SSD, Tuned by THX Audio, Fingerprint Scanner, Webcam, HDMI, Windows 10 S","Windows 10 Home in S ModeAMD Ryzen 3 3200U Mobile Processor with Radeon Vega 3 Graphics (2.6GHz, Up to 3.5GHz)14.1 LCD IPS Display, (1920 x 1080)",Laptop Computers,3.9,90.0,Gateway,412,412,00812550032833,https://i5.walmartimages.com/asr/20866467-14e5-4d08-963b-14802ec47085.fe7f80a9b60244f12008d42c66ec59ed.jpeg?odnHeight=200&odnWidth=200&odnBg=ffffff
66AWUZJTPKLH,20.99,94.0,114.99,Seagate Portable USB 3.0 Non Slim (Capacity),Seagate Backup Plus STHP4000400 4TB Hard Drive - External - Portable,Hard Drives,4.6,44.0,Seagate,267,267,00763649132418,https://i5.walmartimages.com/asr/77aaaef3-6732-4c1e-ab4b-dc0fb04b99bc_1.fbd7da91362b37239dd2dab0fcf5f2dc.jpeg?odnHeight=200&odnWidth=200&odnBg=ffffff
2SAJ02DJA53A,30.0,49.99,79.99,"Contixo B1 True Wireless Earbuds Bluetooth 5.0 Headphones, Sports in-Ear TWS Stereo Mini Headset w/Mic Extra Bass IPX5 Sweatproof Low Latency Instant Pairing Noise Cancelling Earphones (Grey)",Comfortable & LightweightWater ResistantHi-Fi Stereo SoundPortable Rechargable30hrs Listening Time,Headphones,4.8,131.0,Contixo,131,131,00731642719936,https://i5.walmartimages.com/asr/426e05ca-348e-4b1c-9146-4de35d52190e_1.cfca0736046e362c88638d18553e9771.jpeg?odnHeight=200&odnWidth=200&odnBg=ffffff
5LH4NQEYVY2W,50.0,169.0,219.0,"Core Innovations CLT1164 11.6"" Yoga Notebook","11.6"" Touchscreen Laptop with Windows 10 SIntel Atom Processor4GB RAM/64 GB Flash Storage",Laptop Computers,3.8,128.0,Core Innovations,2127,2127,00850017290587,https://i5.walmartimages.com/asr/784c4880-d70d-4a08-88b5-32935f41941e.45a644d2d377fab8086484bb3a422a00.jpeg?odnHeight=200&odnWidth=200&odnBg=ffffff
1WBZE3FXAPRA,43.0,96.99,139.99,Seagate 4TB Expansion 3.0 USB Portable External Hard Drive - STEA4000400,"4TB storage capacity lets you take a variety of music, films, presentations and other files with you on the goUSB 3.0 interface is also backwards compatible with USB 2.0 for simple",Hard Drives,4.6,87.0,Seagate,1852,1852,00763649071922,https://i5.walmartimages.com/asr/2b2f10f6-de50-40bd-97dc-30e7129490ce_1.4924d11739859cf98ed166ade48a6e4a.jpeg?odnHeight=200&odnWidth=200&odnBg=ffffff
1QEO71BT1EDA,15.99,89.0,104.99,"Seagate Expansion 4TB External Hard Drive HDD - USB 3.0, with Rescue Data Recovery Services, and Toolkit Backup Software",SEA EXP+ HDD 4TB,Hard Drives,5.0,2.0,Seagate,117,117,00763649160701,https://i5.walmartimages.com/asr/d4d9939d-b2fa-43e4-a065-0683c1667ab5.c1608adadf10b1062426466c37a65f5c.jpeg?odnHeight=200&odnWidth=200&odnBg=ffffff
3JP7CKJTUZG1,91.16,25.84,117.0,SanDisk Ultra USB Type-C 64GB Flash Drive (SDCZ450-064G-G46),Merchandise,Flash Drives,0.0,0.0,SanDisk,365,365,00619659140342,https://i5.walmartimages.com/asr/637dd056-df05-41fd-bd15-8af675410ccf.c95247796c1997feda0e3286dbf84543.jpeg?odnHeight=200&odnWidth=200&odnBg=ffffff
1Z8QWTCXR8BT,4.88,15.0,19.88,"Merkury Innovations Smart LED Strip Lights, 6.5ft, Trimmable, Dimmable",,Light Ropes & Strings,4.2,549.0,Merkury Innovations,3303,3303,00844702079724,https://i5.walmartimages.com/asr/559bb2f8-f299-4e98-a33d-94ba4b4969b6.b6b5c579196d60910b24919fcc7c9582.jpeg?odnHeight=200&odnWidth=200&odnBg=ffffff
4YE0JDIYLOAV,10.0,49.0,59.0,"SteelSeries Aerox 3 Wired Gaming Mouse, Black",STEELSERIES AEROX 3 BLACK,Computer Mice,0.0,0.0,SteelSeries,203,203,00813682029456,https://i5.walmartimages.com/asr/ec93ff42-9c2c-4e29-898a-d221e7eb97fe.59e35e19ce6507071c37843fd322bb9e.jpeg?odnHeight=200&odnWidth=200&odnBg=ffffff
6CFE2V4QAZFT,4.0,8.88,12.88,Merkury Innovations Smart LED Light Bulb - Works with Google Assistant and Alexa,"No hub required, Wi-Fi is built into the bulbSelect from millions of",Light Bulbs,4.1,1149.0,Merkury Innovations,0,0,00844702072077,https://i5.walmartimages.com/asr/e15b4ae9-a1b0-4a6b-a93a-b818ee4858f2_1.1eeae0645b5aae960d7c57f7689c242a.jpeg?odnHeight=200&odnWidth=200&odnBg=ffffff
0Y6HJOJ6MA9Q,279.01,349.99,629.0,"Intel Core i9-9900K Desktop Processor 16M Cache, up to 5.00 GHz",Intel Core i9 (9th Gen) i9-9900K Octa-core (8 Core) 3.60 GHz Processor - Retail Pack - 16 MB Cache - 5 GHz Overclocking Speed - 14 nm - Socket H4 LGA-1151 - UHD Graphics 630 Graphics - 95 W - 16,Processors,4.8,4.0,Intel,4232,4232,00735858456197,https://i5.walmartimages.com/asr/7e813e32-0189-4f8f-9804-4f4f4af3cb91.caaf72b6a8987eb648dc50faefa46c4d.jpeg?odnHeight=200&odnWidth=200&odnBg=ffffff
4VUUE3Y3UD1K,28.53,129.95,158.48,"Mesh WiFi Router System | 3- AC1200 Mesh Routers | Coverage up to 5,500 Sq. ft (TP-Link Deco M4 3-Pack)","Speeds of up to 1167 MbpsLag-free connections for up to 100 devicesSeamless whole-home WiFi coverage up to 5,500 sq. ft",Network Routers,4.4,153.0,TP-Link,434,434,00840030700125,https://i5.walmartimages.com/asr/e2f5508d-8aa5-451b-b3b8-f89012adbc3c.c8b1a9828c61859c397bd79e638ea24f.jpeg?odnHeight=200&odnWidth=200&odnBg=ffffff
4O78WZY8T492,14.99,75.0,89.99,"HP 20kd - LED monitor - 19.5 (19.5 viewable) - 1440 x 900 - IPS - 250 cd/m - 1000:1 - 8 ms - DVI-D, VGA - black","Hewlett Packard T3U83AA#ABA 20"" Led Backlit Monitor",Computer Monitors,4.3,92.0,HP,152,152,00889899593554,https://i5.walmartimages.com/asr/40ad6e24-4485-4b99-897e-1744decb2549.a49e08a2fa19d58c801ac331bb88d71a.jpeg?odnHeight=200&odnWidth=200&odnBg=ffffff
47W346LWB7CL,30.0,89.0,119.0,ION Audio Game Day Lights - Wireless Rechargeable Bluetooth Speaker System with Lights,?50-watt peak power amplifier with 6.5-inch woofer and 3-inch tweeter?Bass Boost?Woofer glows in multiple colors,Portable Speakers,4.1,26.0,ION Audio,501,501,00842655100366,https://i5.walmartimages.com/asr/b7b1d932-d8a8-4ffc-ad6d-fb1648f46e69_2.df1968eaf6580ed87cb828ac47dc6f2c.jpeg?odnHeight=200&odnWidth=200&odnBg=ffffff
5XI7SBC17V35,20.0,179.0,199.0,Bose SoundLink Revolve Portable Bluetooth Speaker,"360-degree portable Bluetooth speaker
Durable, water resistant design
Up to 12-hour battery life per charge",Portable Speakers,4.6,111.0,Bose,263,263,00017817744188,https://i5.walmartimages.com/asr/8900d567-4a52-4910-bc5d-b10d353b0552_1.475e58e677fe8076b7b96cc4a2beb648.jpeg?odnHeight=200&odnWidth=200&odnBg=ffffff
3W44PK3QE79X,140.0,129.99,269.99,Google Nest Cam Indoor Security Camera,Plug-in-and-go securityNo hub needed24/7 live video,Surveillance Cameras,4.8,1588.0,Google,238,238,00854448003655,https://i5.walmartimages.com/asr/7f8f832a-ea2e-4cb0-85b1-189ececd26a1_1.9578978131fdc2df2c892a8861016802.jpeg?odnHeight=200&odnWidth=200&odnBg=ffffff
2AIY68XU9EVR,8.92,62.0,70.92,Kodak PIXPRO FZ43 Compact Digital Camera 16MP 4X Zoom HD 720P,"16.15 megapixel resolution4.9-19.6mm zoom lens2.7"" TFT LCD screen",Digital Cameras,4.1,73.0,Kodak,0,0,00819900012224,https://i5.walmartimages.com/asr/ed193590-c8aa-4720-aa73-1d09b334ee5e_1.19f1567f3ccb43a1d190d6d8b0e979dc.jpeg?odnHeight=200&odnWidth=200&odnBg=ffffff
3YS65DV6WE5V,50.0,149.99,199.99,"HeimVision HM241 Wireless Security Camera System, 8CH 1080P NVR System, 4pcs 960P 1.3MP WIFI IP Security Surveillance Cameras",1080P Wireless Security Camera System8CH NVR 4 pcs outdoor surveillance cameraIP66 Weatherproof Security CameraMotion Detection and Email Alert,Surveillance Cameras,4.3,162.0,HeimVision,217,217,00631384818365,https://i5.walmartimages.com/asr/74fd7ee5-02b8-42e8-ba6a-a1b3e20f86bd_1.8045dcfb68479f14bf1c1581129d06d3.jpeg?odnHeight=200&odnWidth=200&odnBg=ffffff
6C6NFNYT9FET,24.61,6.39,31.0,SanDisk Cruzer Blade 16GB USB 2.0 Flash Drive - SDCZ50-016G-B35,"Capacity: 16GBUSB 2.0 high-speed transferSmall, ultra-portable design",Flash Drives,4.8,32.0,SanDisk,2810,2810,00006196590004,https://i5.walmartimages.com/asr/1b0fc354-8377-4917-8252-463f112b78d0_1.6ba1e6d6a58fc361ea6226f4db45d764.jpeg?odnHeight=200&odnWidth=200&odnBg=ffffff
5GBBKVYXY2EU,20.0,79.0,99.0,"TP Link Mesh WiFi Router system | Whole Home Coverage up to 3,000 Sq Ft |Two - Mesh Routers| (W2400)",Works with all internet Service providers. Deco W2400 Mesh Router WiFi System. Replaces traditional Wi-Fi Routers with two AC1200 Mesh Routers and works with your modem and internet service. Covers,Network Routers,4.5,419.0,TP-Link,688,688,00840030700071,https://i5.walmartimages.com/asr/50cc2e25-cb13-4003-8064-658b70321aee_1.e2a7f9a76d3f8dd299506a881401a2e5.jpeg?odnHeight=200&odnWidth=200&odnBg=ffffff
66IX78I9ZBUQ,32.3,37.69,69.99,NETGEAR - R6120 AC1200 Smart WiFi Router,"1,500 sq. ft. of WiFi CoverageConnect 20+ devices at once1.2Gbps WiFi speeds for smooth streaming",Network Routers,4.8,6524.0,NETGEAR,639,639,00606449120073,https://i5.walmartimages.com/asr/58b5e763-f3cb-4319-a7c7-f3bf97fee2c0_1.caf1e2dcbf5ab52e199fe0d6aafc3840.png?odnHeight=200&odnWidth=200&odnBg=ffffff
6EDD3VJMKBWH,11.08,72.86,83.94,2TB WD ELEMENTS USB 3.0 PORTABLE HD - WDBU6Y0020BBK-WESN,"Capacity: 2TBHolds up to 1,300,000 photos, 571 songs or 1,053 hours of HD videoUSB 3.0 interface",Hard Drives,4.4,16.0,WD,280,280,00718037855363,https://i5.walmartimages.com/asr/6b2d69d7-6af3-440d-9d39-7b0e4a83d2af_1.89bbeb70f3b9b2b950c7ec2fd94d45a4.jpeg?odnHeight=200&odnWidth=200&odnBg=ffffff
6MNVYDM83FET,30.0,79.99,109.99,Seagate Ultra Touch HDD,"Sporting a chic, woven fabric design on the outside and password protection with hardware encryption inside, Backup Plus Ultra Touch seamlessly blends in the essentials of high capacity, universal",Hard Drives,4.2,15.0,Seagate,1024,1024,00763649131121,https://i5.walmartimages.com/asr/ca21f7eb-a558-46cb-9b79-927c2326f96b.02203849b5290f514fd18cc3a3c8a2fd.jpeg?odnHeight=200&odnWidth=200&odnBg=ffffff
4SYXWCKJS0XE,50.0,249.0,299.0,Bose SoundLink Revolve + Portable Bluetooth Speaker,"360-degree portable Bluetooth speakerDurable, water resistant design (IPX4)Up to 16-hour battery life per chargeWireless Bluetooth pairing with voice prompts",Portable Speakers,4.6,84.0,Bose,0,0,00017817726016,https://i5.walmartimages.com/asr/244170ee-2e8e-4f68-8021-ac0155385386_1.01107bbf022de271f5cb8f795b4b5fd0.jpeg?odnHeight=200&odnWidth=200&odnBg=ffffff
6H2IBPF0MCRR,110.0,149.99,259.99,Philips BASS+ NX200 Bluetooth Party Speaker with Dual Subwoofers (160W),"Shake the room with the Bluetooth party speaker that has twin bass drivers for thundering bass! You can plug in guitar and mic to rock your own tunes. You get party light effects, fun karaoke",Portable Speakers,3.7,17.0,Philips,518,518,00840063200142,https://i5.walmartimages.com/asr/287ec005-b884-49ed-9a22-10f51b87ee5c.e563c413979b831becc680fb48d35113.jpeg?odnHeight=200&odnWidth=200&odnBg=ffffff
498W6XJG584N,20.0,99.99,119.99,Seagate Expansion 4TB USB 3.0 Desktop External Hard Drive - STEB4000100,Plug and play ? no software to installCapacity: 4TB2 year warranty,Hard Drives,4.5,52.0,Seagate,1043,1043,00763649064948,https://i5.walmartimages.com/asr/9d1baf0e-7f2b-4bfe-a696-d6f0cf4a373f_1.8455330245aa99e61eabe9cfd2e38aad.jpeg?odnHeight=200&odnWidth=200&odnBg=ffffff
4HAAWGA8Z7KJ,3.97,26.0,29.97,"Linksys N600 Dual Band WiFi Router, Black Internet Router (2500)",Transfer rates up to N300 + N300 Mbps* offer speed and rangeSimultaneous dual bandEasy 3-step setupIncludes ethernet cable and power adapter for easy setup of a home,Network Routers,4.2,226.0,Linksys,22972,22972,00745883778744,https://i5.walmartimages.com/asr/31e192ed-3cd4-4470-b0f0-07d0bfa32f3b_1.11701981bd32dda7cf778978e3da6b71.jpeg?odnHeight=200&odnWidth=200&odnBg=ffffff
4C118VMJ40LH,22.13,19.99,42.12,"Hyundai 120GB Internal Solid State Drive 2.5""- SATA(SATA/600) - 500 MB/s",120GB Capacity,Hard Drives,4.8,34.0,Hyundai,139,139,00859733006434,https://i5.walmartimages.com/asr/24e26fc3-3789-4af5-98c7-888f428a9094_1.c611d44a91dac66bd75dea1f7412f849.jpeg?odnHeight=200&odnWidth=200&odnBg=ffffff
5PF7YFHPX2A0,100.99,499.0,599.99,"Acer Veriton Desktop Tower Computer, Intel Core i5, 8GB RAM, 256GB SSD, DVD-RW, Windows 10, Black, VX4665G-I5940S1","Acer veriton x4665g desktop - black with silver - intel core i5-9400 (9mb smartcache, 2.90ghz, up to 4.10ghz with intel turbo boost technology 2.0); 8gb (8/0/0/0) ddr4; 64gb ddr4 (16gb x 4); 256gb3",Desktop Computers,0.0,0.0,Acer,572,572,00193199656964,https://i5.walmartimages.com/asr/0688dc78-ced8-4f9f-8c16-ec9245e450f4.d4d4fba77bfcb02d5f747164ec062271.jpeg?odnHeight=200&odnWidth=200&odnBg=ffffff
3N3EZS6VLMX0,39.05,119.7,158.75,"Seagate 5TB Backup Plus Portable Drive USB 3.0, BLACK",Seagate Backup Plus STHP5000400 5 TB Hard Drive - External - Portable,Hard Drives,4.5,19.0,Seagate,355,355,00763649132463,https://i5.walmartimages.com/asr/33bf7aeb-1a18-4053-8682-da54fdaeb751_1.fbd7da91362b37239dd2dab0fcf5f2dc.jpeg?odnHeight=200&odnWidth=200&odnBg=ffffff
70D2C19HE6F7,100.0,49.99,149.99,"Hyundai 480GB Internal Solid State Drive 2.5""- SATA(SATA/600) - 500 MB/s",2.5? hard drive form factor,Hard Drives,4.7,38.0,Hyundai,395,395,00859733006458,https://i5.walmartimages.com/asr/7cd35a56-3899-4d99-8262-ca1d285874ea_1.76fabc4a1239c3d4813df9b4095f7477.jpeg?odnHeight=200&odnWidth=200&odnBg=ffffff
45U0I4455TKL,30.0,99.99,129.99,"SAMSUNG 1TB 870 QVO Series 2.5"" SATA III Internal SSD Single Unit Version - MZ-77Q1T0B/AM",Sequential Read/Write performance reaching up to 560/530 MB/s provides best in class performance via the SATA interface. Improved Random Read performance up to 15% gives users more benefits for,Hard Drives,4.8,41.0,SAMSUNG,233,233,00887276417882,https://i5.walmartimages.com/asr/2f72f630-34ea-4df4-ab93-8c4d3af156b6.d54eb65af7c1e3d34195a6beb91e29d6.jpeg?odnHeight=200&odnWidth=200&odnBg=ffffff
3KWRVQ2NN91Z,25.02,113.98,139.0,Hyperx Cloud Flight Wireless Gaming Headset,"High-quality wireless with long-lasting battery life; Signature HyperX comfort; Immersive in-game audio; Durable, adjustable steel slider; PC, PS4, and PS4 Pro ready; 90 rotating ear cups with LED",Headsets,5.0,2.0,HyperX,350,350,00740617310054,https://i5.walmartimages.com/asr/e6785d78-7024-4c49-8989-182cc438ce9d.603f14728eb9d28c5507d33d2ff24935.jpeg?odnHeight=200&odnWidth=200&odnBg=ffffff
6PVF5DZ96S0Z,51.62,35.98,87.6,NETGEAR - EX6110 AC1200 WiFi Wall Plug Range Extender and Signal Booster,"adds up to 1,200 sq. ft. of WiFi CoverageConnect 20+ devices at onceWorks with with any router",Signal Repeaters,4.3,516.0,NETGEAR,3863,3863,00606449120820,https://i5.walmartimages.com/asr/4f9c904b-3e03-4fd4-9b1b-edf13fbf06e1_1.bb52866fe6a7bc52b158058534f0c7f0.png?odnHeight=200&odnWidth=200&odnBg=ffffff
5NJ7VAMFGFYB,20.99,119.0,139.99,Corsair Strafe RGB MK.2,"Corsair STRAFE RGB MK.2 Mechanical Gaming Keyboard - CHERRY MX Red - Cable Connectivity - USB 2.0 Type A Interface - 104 Key - Compatible with PC, Windows - Windows Lock Key, Stop, Previous Track,",Computer Keyboards,4.7,21.0,Corsair,191,191,00843591060561,https://i5.walmartimages.com/asr/e6c107ea-ecc4-4115-b2b6-88be1695ff3d_1.9b7a7e153733a8a823f69d1d93443d51.jpeg?odnHeight=200&odnWidth=200&odnBg=ffffff
1XL2HAQP0J1T,657.47,1314.95,1972.42,Apple 11-inch iPad Pro (2018) Wi-Fi + Cellular,"11"" edge-to-edge Liquid Retina display with ProMotion, True Tone, and wide color*A12X Bionic chip with Neural EngineFace ID for secure authentication and Apple Pay",Tablet Computers,4.7,550.0,Apple,1,1,00190198878175,https://i5.walmartimages.com/asr/a3aeaca7-0fe5-4722-b70a-e31cb6c967de_1.d0a3b94193e874080cc8ec3058124426.jpeg?odnHeight=200&odnWidth=200&odnBg=ffffff
5MD89T3Z98JM,40.0,149.99,189.99,Asus Ac2900 Dual-Band Wrls Router with 4-Port Gigabit Lan,AC2900 DualBand Wi-Fi Router,Network Routers,4.1,41.0,ASUS,595,595,00889349624609,https://i5.walmartimages.com/asr/7681ee9c-43b4-44ef-b1a3-a44bcc84ecd3_1.5ed1ebf10da26ef75d32ce8a23029f3c.jpeg?odnHeight=200&odnWidth=200&odnBg=ffffff
6F1ZE5REN2PY,26.92,33.07,59.99,NETGEAR - R6080 AC1000 Smart WiFi Router,"1,000 sq. ft. of WiFi CoverageConnect 15+ devices at once1Gbps WiFi speeds for all your devices",Network Routers,4.8,1502.0,NETGEAR,3474,3474,00606449120288,https://i5.walmartimages.com/asr/dac5a7a4-2db9-4477-aee6-be8d6f6fbd0c_1.caf1e2dcbf5ab52e199fe0d6aafc3840.png?odnHeight=200&odnWidth=200&odnBg=ffffff
2GKM2GGPUO8V,80.0,119.99,199.99,Philips BASS+ NX100 Bluetooth Party Speaker with Single Subwoofer (80W),14 hours of play time from a single chargeAwesome party light effects2x mic inputs and 1x guitar input (6.3 mm),Portable Speakers,4.8,11.0,Philips,385,385,00840063200159,https://i5.walmartimages.com/asr/0f821019-4c9b-4dec-98c1-fbe3966b2276.883079d79d57806a7d09f83a6dafec8b.jpeg?odnHeight=200&odnWidth=200&odnBg=ffffff
4T9L5I6JVH0N,40.0,139.99,179.99,"HeimVision HM245 8CH 1080P Security Camera System, 5MP-Lite HD-TVI DVR 4Pcs 1920TVL Outdoor/Indoor Weatherproof CCTV Surveillance Camera with Night Vision, Motion Alert, Face Detection, Remote Access",IP66 Weatherproof Camera1080P Security Camera SystemMotion Alert and Face DetectionIt can support up to 8 camerasPrivacy Protection and Mobile Viewing,Surveillance Cameras,4.4,149.0,HeimVision,647,647,00631384822461,https://i5.walmartimages.com/asr/ecfb7435-27c8-42f0-9334-1d9bb5e8ca2d_1.5c506f3d09ebdb638c2bff558ac9fcc1.jpeg?odnHeight=200&odnWidth=200&odnBg=ffffff
3VZQ9TSKFZ8K,87.06,23.7,110.76,Sandisk Extreme Go 64GB USB 3.0 (3.1 Gen 1) Type-A USB Flash Drive - SDCZ800-064G-G46,Buy with confidence. Excellent Customer Service & Return policy.,Flash Drives,5.0,4.0,SanDisk,185,185,00619659152161,https://i5.walmartimages.com/asr/d50b0d5b-ba07-4d1f-9601-f9c9c6184e96_1.0bb7cb9e53c2ed985849610b1736fa1f.jpeg?odnHeight=200&odnWidth=200&odnBg=ffffff
